,cleaning,sentimen
4989,males kerja jarak rumah sekolah bu ketemu orang jalan depok rumah banget banget korban covid kemarin waspada,positif
4990,hffttt masuk kuliah pulang pergi tangerang depok september terpikirkan skrng huhuhu,negatif
4991,late post senin februari hallo namaku humam belajar persiapan ujian depok program plus pembinaan lulus ujian sekolah program pembinaan,positif
4992,smp negeri depok masuk besok uts,negatif
4993,jaman pulang pergi kuliah bekasi depok kayaknya parah iya rakyat pulang kerja tenang diganggu kutu memperjelas kesenjangan sosial where are youuuu sila,netral
4994,mahasiswa lombok tewas tergantung indekos kelurahan caturtunggal kecamatan depok kabupaten sleman rabu,positif
4995,woy mas sik kuliah smt ndik ui depok mas,netral
4996,berita mahasiswa kampus depok habis umrah semoga ditangani,netral
4997,maun temenan anak depok ngerih,negatif
4998,sahabat tahunku kls sd woy gila hatam dunia korea an boyband girlband drama reality shownya suka banget joget tertawa keluarga terima kasih dengarkan cerita main terpisah depok bandung,positif
4999,pare pare berstatus mahasiswa depok satunya pulang umroh,positif
5000,lokasi depok jawa barat menit stasiun depok cluster semi furnished juta free biaya smp shm,positif
5001,tambahin ibnu hajar boarding school sekolahnya sunnah parah fasilitasnya beuh dikasih laptop sekolah gratis berlokasi depok,netral
5002,alhamdulillah salah ikhtiar yayasan alhikmah cipayung depok sterilisasi sekolah berjalan lancar bentuk salah pelayanan sekolah walimurid lingkungan pemerintah kota kota,positif
5003,organisasi kemanusiaan sekolah relawan membentuk kampung siaga covid perumnas beji utara depok,positif
5004,kelas depok kelas karawaci anak bimbingan kp proposal on progress dikerjain nungguin bocah sd ngerjain tugas onlen ngajarin cekrek upload repeat,negatif
5005,depok mauu kaii biar merch exo aje pliss bikos sticker exo seribuan belinya bang abang sd mutualaann ayo,positif
5006,alhamdulillah depok he diem rumah kemana cm ditemenin au tugas kuliah kuliahnya raii,positif
5007,kejauhan ndraa kesono sono depok sekolah stl apa-apa hahaa,positif
5008,mai interview book jadwa kuliah onlen nich depok jiatou,netral
5009,ikii teman kuliah banget arek e uenak friendly e sing easy going kemana hahah banget bepergian kemana nonton cari promoan bareng depok tertawa semoga dirimu semngat kuliah e sepurane sing akeh yoo,positif
5010,area depok jakarta pengiriman gosend someday lbh cepat smpe lbh safety tas rada kece pengiriman by jne kesemua daerah ayo gaes optimalkan social distancing order rendang bahan hrg rendang,netral
5011,sd lumayan kekerasan terima sd dines bandung pulamg depok seminggu sebulan lupa kayaknya habis dipukulin grgr lupa,netral
5012,sila langsung besok woro mikir masak absen teman berdomisili bantu blast wag komplek arisam keluarga orang tua sekolah yah arie,positif
5013,dear admin mati min daerah rangkapanjaya pancoranmas depok jam iya kuliah online membutuhkan listrik,positif
5014,mrimpun mbakyu mohon dibantu informasi kontak lembaga bantu penyemprotan disinfektan kasihan sekolah depok amp pinggir jakarta waiting list penyemprotannya daerah pandemic massif corona suwun sanget,positif
5015,nama samba pakai lado umur kota depok sepatu safety sepatu lokal sepatu hadiah hadiah sepatu sekolah kasih hadiah sepatu,positif
5016,yak bayangin kuliah online depok internet kualitasnya berdasar pengalaman wfh senin lepas jam tidur siang anak iya ribut larian teriak rumah set jam kuliah jam segituan,positif
5017,lulus kuliah kosan berani tidur kosan lingkungan kosan individualis numpang kantor teman kelapa depok tidur telentang dilantai beralaskan karpet matras setahun numpang rumah adek,positif
5018,mewek orang keluarga rumahh anak rantauu kampung halaman gara kampung halaman korona depok nyaa teruss meluk keluargaa kumpul barengg kenyataan bisaa takut korona,negatif
5019,kuliah depok margonda kelapa gg kapuk gg pinang,negatif
5020,disdik depok siswa belajar rumah,positif
5021,kakak lulus sekolah kerja pt beralamat wilayah perbatasan depok jaktim after than year kerja disitu resign install aplikasi aplikasi notabene nya mencari jodoh wgwgwg,positif
5022,asli serang kuliah depok tertawa depok manaaa,positif
5023,orang positif corona bertambah terkhusus daerah depok suspect covid khawatir pemerintah dki disusul depok instruksi siswa belajar rumah,positif
5024,prakarya sd terlengkap depok,netral
5025,amikom desa kesik kecamatan masbagik kabupaten lombok timur saksi wildan jagadati niko lazarudi sleman laki laki islam pelajar mahasiswa alamat jl kantil perumnas cc ngringin rt condongcatur depok sleman saksi fathul mungin cilacap,positif
5026,guru smp kota depok anak muridnya senin liburin disuruh masuk mengisi nilai dikata guru kebal corona kali,positif
5027,banget hardworkingnya lov how always dream big and super focused now ure in depok doing wonderful things biarpun sejurusan youre doing great where r right now im so proud of im maaf ion keep in touch as much but ily,positif
5028,corona wali kota depok sekolah libur jalan jalan,positif
5029,nemenin ajata ngerjain tugas sekolah terima kasih corona karnamu akooh pening tugas h h kp kresek limo depok,netral
5030,guru ngajar kelas guru manean membela banyu cakrabuana,positif
5031,rika dom tangerang kuliah depok salam kenal,positif
5032,cegah corona intruksi walikota depok liburkan sekolah tutup alun alun,positif
5033,teman kuliah main daerah senopati baliknya keretaan ofkors turun manggarai depok pas nyampe manggarai bukain jalan biar tertawa banget inget muka bloon banget,positif
5034,rikhad kalam kota depok alasan sekolah kegiatan aamiin,positif
5035,manusia kenal smp jugaa oke lagii nyanyi love her voice si penulis keep going love lagii terjebak depok t t stayy safe syngkuuu stay healthy yaa reply beautiful just the way you are,positif
5036,coxco temenin depok,negatif
5037,kerja akhwat depok front office bismillah homeschooling alam depok salah lembaga pendidikan memadukan konsep pendidikan non formal homeschooling membuka front,positif
5038,kerja ikhwan akhwat depok guru sd smp amp bismillah homeschooling alam depok motto berakhlak aktif amp inovatif membuka guru sd smp amp kriteria muslim muslimah,positif
5039,kerja ikhwan akhwat depok guru tk bismillah homeschooling alam depok motto berakhlak aktif amp inovatif membuka guru tk kriteria muslim muslimah pendidikan min,positif
5040,curahan hati colongan ges temenku asli depok kuliah malang univ malang memberlakukan kuliah online tatap muka besok depok mikirin resiko bklb perbuat bahayain orang malang pgn ngatain teman,negatif
5041,kenal teman banget jalan datengin event jakarta event takut kmna mna event bekasi smp jalan waw depok bekasi anak hilang,positif
5042,berita corona indonesia depok b ajadah takut smp mandi x habis corona mata bnrbnr mata seram banget ajgg yaallah semoga cepat pulih iya,negatif
5043,depok kuliah domisili kang mangga bandung kabari mudah mudahan mempertemukan,positif
5044,smp depok kakak depok mananya,netral
5045,junior hahahaha iya kali depok sesempit,negatif
5046,jakarta pas anak anak dufan atrium senen saking sony ericsson ti depok jual bnib naek krl ekonomi kali pintu biar adem teman kuliah minggu giliran nganter teman,positif
5047,depok sarangnya pks kuliah kos depok gabung liqo kawin muda kuliah menetap permanen depok berkembang biak,negatif
5048,hft kelompok minggu dirumah w rumah depok pusat jakarta krl mrt dirumah iya dirumah kuliah virtual alias class kebijakan wfh kantornya,positif
5049,kuliah depok paham keresahannya wakakaakkaka,netral
5050,cirebon kuliah depok,netral
5051,dok status teman dokter cewek depok mohon bantuannya dok,positif
5052,kerasa banget dengarkan pas masuk kuliah lulus hbd prambors terima kasih banget nemenin perjalanan bolak tangerang depok,positif
5053,corona hiv terbesar negri spp hamil diluar nikah pedoman masyarakat depok hidup larry tkut malu,netral
5054,coxco anak depok mutualan yu,negatif
5055,nmax klakson bus pas lihat spion nmax bgst jalanan depok anjing banget muat mobil pasn banget jalanan ramai perumahan ngapasih heran gamo sekolah didepok panas bikin hitam akhrnya sekolah bogor kwkwkw,positif
5056,teman teman mutualan darimana ajaaa ngomong - ngomong tinggal depok kuliah pwt,netral
5057,depok kuliah malang,negatif
5058,lanjutan pakai siger a pakai siger pas nikah ms bahasa sunda pas sd gaya gayaan pakai siger a tapikan depok ms gausah gaya gayaan umpetin siger pas h,positif
5059,kuliah ui cabangnya uny ui buka cabang depok jogs jugaa,positif
5060,njirr gjadi kuliah depok wkqk,netral
5061,kakak ldr suaminya depok cikarang,negatif
5062,samaaa kemarin w depok safety measures smp pakai sarung tangann ganti x masker,netral
5063,bts of shibori amp jumputan t shirt ekstrakulikuler batik angkatan ii smp depok sleman yogyakarta,negatif
5064,kuliah ilmu kesehatan salah ptn depok cianjur korban wafat maret maret korban dites ulang pemerintah bilang negatif maret gubernur jabar bilang positif aneh,positif
5065,libur kuliah jaga kesehatan menghadapi virus corona covid pergi lupa pakai masker bawa hand sanitizer,positif
5066,suka ngatain kota depok kuliah depok tu miris iya tertawa,netral
5067,coxco titipan anak depok kuliah mutualan ayo,netral
5068,citra hacker sebentar sekolah khusus hacker depok habis depok menang penghargaan hacker terbaik,positif
5069,diriku depok libur kuliah minggu,positif
5070,jadwal krl perubahan g min kereta depok kah jadwalnya perubahan terkait corona ramai terima kasih semoga sehat mimin kru krl aamiin,positif
5071,tolong masker smp harganya mahal butuh isi tembus rb kebutuhan pokok,positif
5072,gara gara corona pacaranku tertunda orang depok mamah ketemu wkwkw iya allah drama,negatif
5073,lahir rs gereja jatinegara cililitan ciracas pindah bekasi sd pagi kramat jati sd pagi susukan smp ciracas cijantung kuliah depok ayah pensiunan pemerintah daerah dki orang jakarta,positif
5074,aktivitas warga kota depok berkurang ruas jalan lengang pasca dikeluarkannya surat edaran walikota terkait meliburkan sekolah amp keramaian antisipasi penyebaran virus corona,negatif
5075,sd mane informasi depok,netral
5076,lelah kuliah daring kampus pulang pergi depok jakarta tertawa,positif
5077,rumah asri amp nyaman harga jutaan depok huni menit stasiun citayam puskesmas amp rsud depok toll desari secured gate system keamanan jam sekolah murah sekota depok rumah,positif
5078,krisis masker zaman kuliah depok transportasi krl stasiun tujuan stasiun jarak stasiun jalan raya melewati mall,positif
5079,dahla padang enak tanamo gerobak sd depok,netral
5080,teman kabar kuliah ketemuan pas libur main fifa subuh kuylah main depok guee semangat kuliah olahraganya,positif
5081,yaa kar masi fad pas diinvite musrenbang iya pidato formalitas ujungnya tuntutan uang terealisasikan apbd depok dananya,positif
5082,fellow tangsel kerjanya depok cemas mahasiswa libur staff libur coba,positif
5083,atap ruang kelas sd kemiri muka depok ambruk,negatif
5084,pijat padepokan widodo sejati smp depok backsoundnya kayak p,netral
5085,lingkungan sekolah depok make suporter sekolah gtu mgetes bilang wiiiihhh keren bajunya,positif
5086,depok sekolah anjing,netral
5087,new post depok liburkan sekolah pekan has been published on dakwah online,positif
5088,pts online disukai murid sd integral hidayatullah depok,positif
5089,suspect covid mahasiswa depok polman dirujuk parepare,netral
5090,kebijakan pemerintah pemerintah daerah seeprti solo depok dki jakarta bekasi provinsi jawa meliburkan sekolah menggantinya kegiatan belajar mengajar rumah,positif
5091,anak anak sekolah rumah menyelesaikan tugas diposting jam jarak depok sentul semarang dirasa google classroom,netral
5092,eh iya allah ngomong - ngomong sekolah impianku smpe belok tetep depok,positif
5093,mohon informasi gangguan area taman duta cisalak depok kemarin maret jam outage layanan sd mohon pencerahannya terima kasih,positif
5094,alhamdulillah siang sore kemarin membersamai manajemen yayasan pimpinan sekolah guru guru sit ruhama depok rapat kordinasi rangka kebijakan social distancing antisipasi penyebaran,positif
5095,hallo admin komplain meteran air rumah rusak minggu tlfn pdam depok dth kermh smp tlfn smpe x iya in tindakanya,positif
5096,bahaya mngancam rakyat depok pandemik gaung perhatian program himbauan antisipasi smp rw rt acara keramaian brubah trlihat masyarakat peduli brgelimpangn mayat naudzubillah cc,negatif
5097,tujuan presiden merumahkan rakyatnya iya rantai virus nya ortunya mencari kesempatan liburan selagi anaknya libur sekolah iya kebacut sebentar kena virus corona salah pasien depok bersin peta,negatif
5098,dijakarta sekolah dasar negeri gurunya sekolah pdhal rumahnya depok teori x praktek,positif
5099,pdam depok imbau pelanggan bayar tagihan air daring,positif
5100,orang heboh corona mahasiswa jawa p jawa orang tua nanyain kabar anaknya penelitian disuruh ortunya tu orang tua corona separah bogor orang depok amp santui disana,negatif
5101,coxco midnight call or chat jenuh kuliah online m depok,positif
5102,listrik belacasa langganan banget mati lampu perum belacasa jl tole iskandar a kelurahan tirta jaya sukmajaya depok jam siang sd salah milih direksi parah pelayanan listrik depok,positif
5103,tolong followers teman jan cepu plsssssss tolong tolong cepu tendang ampe depok ok mari gembok sebentar,positif
5104,kuliah depok main mall gmne,positif
5105,iya semembludak penggunaan transportasi jam operasi dikurangin wfh libur sekolah labil kerja jakarta orang jakarta lupa orang bekasi tangerang amp depok,positif
5106,tiptop depok kesono pas kelas sd kerja jalan th apaka disana,netral
5107,orang banten kuliah depok super gemey banget pipinyaahh mampir,positif
5108,depok kayak bocah kelas sd ye adeeeee aje kelakuannye hadh,negatif
5109,lapor min atap sekolah sdn kemiri muka margonda gang kp gedong amruk peristiwa hujan deras mengguyur kota depok,positif
5110,depok mananya kuliah dimana skrng tertawa,positif
5111,guru dki kawatir mestinya siswa libur guru libur guru tinggalnya daerah epidemi kereta depok bogor bekasi tangerang lain-lain seram tranportasi berjubel ngantrinya ketulungan,positif
5112,aswb anis siswa diliburkan guru bingung guru rawan kena virus tinggal bekasi depok tangerang kramajati daerah rawan,negatif
5113,musim hujan bbrp ngerasain petir depok smp bikin kaget,netral
5114,jakarta dit pinggiran kayak tangsel depok kena imbas nya jualan dikantin sekolah kerasa banget,negatif
5115,coxco negeri depok anyone,netral
5116,riva l depok kuliah jurusan pr,netral
5117,alhamdulilah sanggar asriwelas visit dinas pendidikan kota depok rangka perpanjang an izin operational persiapan akreditasi nasional dibawah kemdikbud ri mutu pendidikan,netral
5118,dilemanya novel beli beli massive semenjak kuliah depok anjing haduh,positif
5119,mbak mbaknya depok subang cewek dom beda sekolah putus susah bngt mertahanin nya,netral
5120,ukuran subang depok ldr iya hmmmmm ok ok ok,positif
5121,ribuan jamaah padati haul kh a hasyim muzadi pesantren mahasiswa al hikam depok,netral
5122,ldr depok jakarta was was ditinggal kuliah jarang ketemu yaampun,negatif
5123,sekolah menegah negeri sman kota depok menerapkan metode belajar jarak mencegah penularan virus corona,negatif
5124,pemerintah kota pemerintah kota depok meliburkan sekolah mencegah penyebaran virus korona pengendara ojek online depok tanggap menutup singgah shelter jalan raya kartini,negatif
5125,cegah korona sekolah depok diliburkan pekan,positif
5126,sekolah depok diliburkan,positif
5127,tanggal orang depok orang solo positif wajar arahan meliburkan sekolah lihat tanggal artikel penempatannya dibalik beda nangkepnya,negatif
5128,mahasiswa rantau depok gausah pulang iya,negatif
5129,dom depok kuliah bandung,netral
5130,tolong routernya lampunya normal internet orang rumah butuh internet kuliah kerja beji depok,positif
5131,libur mbak berdasarkan surat edaran walikota depok nomor huk dinkes tindak pencegahan penyebaran covid kota depok tinggal kepala sekolah yayasan menindaklanjuti surat edaran,netral
5132,dijual cepat rumah jalan raya lenteng agung jagakarsa jakarta selatan alamat jalan raya lenteng agung arah depok smp lenteng agung jakarta selatan spesifikasi rumah lantai luas tanah m luas bangunan m,positif
5133,dewan pendidikan depok apresiasi program organisasi penggerak kemendikbud depok news,netral
5134,motor depok smp bundaran hai sugohessssss self,positif
5135,dewan pendidikan depok apresiasi program organisasi penggerak kemendikbud,netral
5136,dkr dukung gubernur jabar walikota depok sekolah rumah lock down depok news,positif
5137,dkr dukung gubernur jabar walikota depok sekolah rumah lock down,positif
5138,what adik hell gilakk depok cibubur ditambah sodara sodaraaa,netral
5139,bacanya bikin kangen kuliah kangen kuliah depok kuliah iya paper kelar iya ayo kampus,positif
5140,depok kota mati libur pelajar mahasiswa tukang nasi uduk penari balet orang tua guru dhuafa janda duda satuan pengamanan bca tukang semir servis jam korek gas tisu galon karangan bunga berduka cita armada full album tali tape topi jakcloth,netral
5141,depok anak sekolah masuk,negatif
5142,situasi stasiun bekasi pagi ramai kepadatannya berkurang stasiun manggarai berkurang kepadatannya kondisi kereta arah jakarta sudirman padat kondisi kereta depok bogor sepi mahasiswa libur,negatif
5143,wish me luck alisya dom depok libur pgn skincarean rumah lumayan pas masuk sekolah glowing sebenernya menang sayang dipake,positif
5144,analisis iya riset anak kelas x depok,negatif
5145,menyusul jakarta depok tangerang lain-lain newyork meliburkan sekolah,positif
5146,informasi sit alhikmah depok terkait surat walikota depok dinas kesehatan dinas pendidikan amp gubernur jawa barat,netral
5147,kerja kampus ui depok mahasiswa diliburin kerja diliburin gimnana mnaa kemarin habis sakit dokternya was was corona banget gejala demam suhu alhamdulillah sembuh takut sbnrnya rumah kerjaan,positif
5148,what a sabtu depok selasa kuliah,netral
5149,ouh depok sekolah liburin iya sikap bang walkot hobi nyanyi,positif
5150,iya inii sekolah jaksel diliburin depok,positif
5151,wkwkwkwkw masi hahahahaha yaaah nnt kuliah depok janjian iya kuat suruh samper bekasi rumahku bekasi tertawa samper depok iya goodluck hana smoga mulus perjalanan lets keep in touch,positif
5152,muntah pelengkap efek kemo senyum mamah menandakan sja mamah menjalankan radiasi hri bertemu mamah mamah menginap dirmh saudara sekolah depok,negatif
5153,welkam to depok alias besok kuliah aman,netral
5154,takut banget pas medan covid mereda disuruh depok kuliah what the fuck,positif
5155,sadar pambes rp jakarta depok panik,negatif
5156,isu puncak bogor ramai foto foto kemarin pagi siang kemarin sore keputusan wfh bebrapa daerah meliburkan sekolah jakarta depok so publik digiring kemana,positif
5157,dampak corona un diundur kepala sekolah depok,netral
5158,teman depok bantuin dagangannya ramai lokasi sekolah bintara,positif
5159,sekolah depok diliburkan kecuali guru karyawan kerjaan tetep perpus huehehe,positif
5160,bogor depok pakai krl jam siang sore pas krl kosong kuliah diliburin kampung was was kendaraan,netral
5161,iya depok lockdown edaran walikotanya sekolah wisata instansi lain-lain tertawa yep jaga kebersihan amp kesehatan iya,positif
5162,total positif warga depok warga cianjur meninggal warga kabupaten bekasi keluarga cianjur warga bandung warga cirebon positif covid terpantau banget emil sekolah nya rumah libur,positif
5163,depok liburkan sekolah pekan,positif
5164,langkah pemerintah provinsi jabar pemerintah kota depok liburkan sekolah dinilai,positif
5165,sm teman kuliah depok jakarta bekasi tangerang iya,netral
5166,mesti bijak link berita feb suspect mahasiswa isolasi dibatam orang depok positif corona kena tanggal,negatif
5167,doa training motivasi siswa terbuka sman depok tkb cinangka,positif
5168,manteman dik adik kuliah depok jakarta diliburin jalan jalan tetep adain jam belajar rumah lockdown masuk lupa pelajaran uas hayo,positif
5169,ao kantor w nasib pas kemarin jumat ngetag mobil besok snin now watching serpong depok bogor bnyak tmpat pokoknya smp confirmed case nambah cancel ketemu customerny,positif
5170,iya kuliah libur depok kemana libur,positif
5171,kuliah online depok dosen internet bagus internet indihome,positif
5172,iya bawa tugas kuliah rumah kosan cari makan daerah depok at least rumah keluarga kebih aman ngerasanya,positif
5173,pengumuman pengumuman sesuai arahan walikota depok terkait penyebaran virus covid pkbm semesta ilmu memutuskan ujian sekolah teori praktek paket c tanggal,netral
5174,assalamu alaikum punten salah sekolah menengah kejuruan depok sekolah meliburkan siswanya surat edaran,positif
5175,gaes berlaku sekolah liburkan minggu senin corona nyebarnya luas banget denger depok mentri perhubungan ketinggalan banget kah informasinya,positif
5176,kuliah pjj dianjurin pulang rumah bingung pulang informasi apapun pondok kayaknya si depok,positif
5177,suka bingung depok kayaknya teman depok seangkatan diatas angkatan banget orang hebat penuh prestasi iya desainnya sedih meilhatnya,negatif
5178,sebel beli antis perlindunganku depok sin city kuliah seat in huftie,negatif
5179,ayo hadir acara seminar pelajar mahasiswa stadium general kota depok lembaga studi islam elsi tema mitos takhayul end insyaallah dilaksanakan,positif
5180,pemerintah kota depok liburkan sekolah cegah sebaran corona,netral
5181,strategi marketing food court itc depok lt barbar suka ye kayaknya pas,negatif
5182,teman berkurang drastis mainnya warin dikit kuliah depok walhasil ketemu kawan asa karagok nyapa orang inget iya tertawa,positif
5183,stay kosan pemberitahuan ngomong - ngomong orang depok diliburin kuliah online pulang tertawa,positif
5184,teman bangka depok kemis kmaren sertifikasi gajelas harganya of course kuliah edaran libur mingguan men pulang pergi beda pulau ongkos sebecanda nyusahin kampus,netral
5185,anak sekolah vis kerja kayaknya yaa jakarta kerjaan depok kampus ui mahasiswanya tanggal kelas tatap muka,negatif
5186,depok keputusan sekolah libur senin tanggal maret,positif
5187,ok un undur amp sekolah diliburkan kali denger libur minggu suka,positif
5188,cm uhamka cabang pasar rebo blom nerapin kuliah online apaa dijkt dkt sm depok,netral
5189,alhamdulillah walikota depok meliburkan sekolah,positif
5190,cm haloo mahasiswa psikologi butuh responden wawancara sifatnya ringan bersedia domisili depok bogor yaa nnt detailnya,positif
5191,depok kemarin lumayan ambil keputusan tutup sekolah bikin psa teteup pakai muka si walkot gede warga depok menilai,netral
5192,sekolah kota depok diliburkan tanggal maret maret kampus depok,negatif
5193,libur sekolah akibat wilayah dki jakarta depok kota surakarta,positif
5194,smp depok iyaa gajinya gede ngajar kelas menjamin anak nyambung kadang tolong suka ngertiin berkutat kutit,negatif
5195,dki depok libur sekolah tangerang begimane bos bilang anak tangerang kebal korona ye,positif
5196,sekolah iya depok,positif
5197,sekolah depok fix libur adek libur minggu terhitung besok senen,positif
5198,antisipasi corona pemerintah kota depok liburkan sekolah,positif
5199,sekolah depok libur cha bocah heppi sekolah mall ribut bilangnya bosen,positif
5200,news depok meliburkan kegiatan sekolah minggu,positif
5201,mohon maaf layanan kantor wilayah kota bekasi kota depok kota bogor kabupaten bogor dibatalkan menjaga kesehatan melaporkan tahunan daring,netral
5202,gubernur murid murid belajar rumah guru sekolah belajar jarak guru rumah kasian guru tinggalnya bekasi depok tangerang kerja jakarta mohon dipertimbangkan,positif
5203,iyes ujian perubahan amp penjadwalan ulang kampus depok dikosongin ujiannya kampus depok salemba ngurangin mahasiswa masuk,netral
5204,penyakit dibawa politisasi mas kota depok sekolah diliburin nyawa kesahatan manusia ilangin mas dengkinya anisbaswedan sepakbola ditunda daerah hentikan aktivitas kerumunan orang mas,netral
5205,liburkan kuliah mendadak kampus depok sepi banget kerjaan libur,positif
5206,bbrp dipertimbangkan setau solo semi lockdown sekolah jakarta depok solo diliburin,positif
5207,sekolah depok raya lockdown,positif
5208,kuliah online depok tertawa,positif
5209,pemerintah kota depok meliburkan sekolah pekan,netral
5210,ykh ayah bunda orang tua siswa tk sdit smpit ruhama depok perihal tindak pencegahan penyebaran virus corona depok maret depok,positif
5211,sekolah jabar diliburkan depok wilayah jabar kali kena bandung dki jakarta banten jateng,positif
5212,instruksi wali kota depok cegah penyebaran covid liburkan sekolah tutup alun alun,netral
5213,jakarta depok kota bekasi kabupaten bekasi mengeluarkan himbauan meliburkan sekolah yeeaaii emak seneng suka bocah libur kruntelan sibuk dunianya menomer,positif
5214,penjelasan lengkap ui terkait kuliah jarak uts dirumah depok news,positif
5215,coxco kemarin usbn paket c sekolah master depok undur grgr,positif
5216,depok suruh libur sekolah bilang,positif
5217,heran daerah gercep dki solo smp depok iya berdoa semoga dijauhkan musibah aamiin,positif
5218,w kuliah depok masuk liburnya besok soalna,negatif
5219,bu sekolah depok menerapkan libur siswanya orang tua mengajukan izin sekolah anak meliburkan syukron,negatif
5220,punten mengumumkan jabar kota bandung kota bogor kota depok meliburkan sekolah nasip kota kabupaten kabupaten jabar,positif
5221,diliburkan liburan anak sekolah jakarta bekasi depok lain-lain diliburkan pekan diliburkan tamasya kemana tujuan diliburkan wabah virus dikendalikan mengurangi interaksi keramaian melancong kemana,netral
5222,gkj depok minggu ibadah sekolah minggu minus salaman,positif
5223,semalam beredar surat wali kota depok liburkan sekolah pertimbangan lbh mas alhamdulillah sekolah anak diputuskan belajar rumah sisa ujian,positif
5224,seharian cuci tangan melulu sepuluh kali keriput tangan depok liburin sekolah two weeks rumah g ngajar,positif
5225,setuju walikota solo berani ambil resiko duluan tetapin klb bupati sragen berani tutup sekolah walikota depok kepala daerah mikirin rakyatnya ambil resiko dahului pusat,netral
