,cleaning,sentimen
3351,iya orang bekasi kuliah depok skjsnd siyaap,netral
3352,orang jabodetabek menganggap tangerang depok bogor bekasi jakarta kuliah temenku nyangkanya kota masuk provinsi jakarta,netral
3353,pandemi corona mempengaruhi sistem penerimaan peserta didik ppdb pemerintah kota depok ppdb ajaran online,negatif
3354,adakah dom boyolali takut pindah depok gada teman masuk bingung kemana,netral
3355,properti limo depok lt m lb m lantai parkir pribadi shm rumah sekolah ibadah pusat belanja terbebas banjir rumah cek detail,positif
3356,lahir jakarta depok sekolah jakarta mama orang indonesia daddy orang indonesia alisnya asli pipinya ko gede banget,positif
3357,pemerintah kota depok larang acara studi tur perpisahan sekolah,positif
3358,si abang kuliah ui kebohongan lanjutin iya bang ui depok jaket kuning abang gojek ohh iya iya iya jurusan neng anjrt dalem hati mampus anaknya ngeboong boong mimik mukanya panik,negatif
3359,kerja pergi kampus malu bilang bang alhasil bilang habis pergi kampus bang abang gojek pergi kampus dimana ui bang abang gojek hahhhh ui depok bagus buset yaa hati kaya,positif
3360,lahir jakarta depok bahasa jawa orang tua asli jateng nyeletuk pakai bahasa jawa teman teman jakarta prestasi dipanggil jawir,negatif
3361,nasib smp anak pasar smp banter cj anak cibubur imitasi depok ikutan,netral
3362,orang jawa kulon etan tnya merantau kemana jakarta pdahal tangerang depok bilangnya tetep jakarta,netral
3363,lahir jakarta akta kelahiran bogor sd smp depok kabupaten bogor alias cibinong ditanyain cibinong dimana iya hwkwkwkwk bilang bogor bogor tepatnya bogor coret eh deng bogor kabupaten,positif
3364,bukber pas kuliah yah kuliah depok rumah bogor lbh buka jalan rumah pas kerja,positif
3365,st depok toko jual koran sm majalah seminggu x kesitu nanyain bang majalah bulutangkis jaman abangnya smp bingung rajin banget tokonya nanyain betapa bodohnya,positif
3366,informasikan perkiraan ppdb smp daerah kota depok,netral
3367,selingkungan anak daftar sekolah islam salah tua depok diterima ujiannya lembar kerja tabloid anak teman sepantaran g lolos masuk sekolah inpres,negatif
3368,kuliah depok wkwkw,netral
3369,nastel kukel iya hotspot anak depok pancong smp atletik stadion makannya situ couldn t agree more barel vibe kutek mahasiswa hahaha,negatif
3370,taichan senayan ditertibin trotoar kemana wkwkwkw semenjak kuliah terisolasi depok,negatif
3371,menit stasiun depok amp terminal depok akses rs mitra keluarga hermina mudah sekolah disekitar bagus bagus berminat hubungi papaku chandra,positif
3372,lahir depok th jepara kanyut dikali depok kuliah boyolali bsr depok bapa tegal mamah jepara kumpul keluarga dibilang sombong basa jawa kumpul keluarga nyusul pakai basa jawa,positif
3373,lahir didepok diepok sekolah didepok belanda depok,positif
3374,kejadian ironis semalam salah rs depok mengantar sepupu lahiran anak usia sekolah dasar dibawa ruang perawatan lift didampingi suster melambaikan tangan orang tuanya seraya,netral
3375,lahir bogor skrng depok depok orang depok orang depok tk depok kuliah bogor semoga jodoh nya beneran orang depok aamiin depok kota tercinta amp ternyaman depok city,positif
3376,lahir jakarta depok orang jakarta orang jawa smp kalimantan selatan cimahi kuliah bandung tinggal tangsel darimana,positif
3377,kangen depok walopun panas suka tetiba ujan jalanan nga bagus bagus isilop macet nga keruan kangen gess huf ayo kuliah,positif
3378,bngst smp agt depok siyeon wendy blom ngukur leo halu dokter days lihat anak nct ketawa ampe sgini males,netral
3379,"smp on the way , jalan depok my husband my future my everything ngahahhaha",netral
3380,hai alumers alumni tugu depok angkatan gamananta present donasi kebaikan saudara ayo berbagi kebaikan gamananta donasi disalurkan rekening,positif
3381,wktu sd depok bedalagi jamanan sd lapangan olahraga banget disitu sengaja jalannya biar bareng anak cowok salah satunya sukain wkwkw heran sd ganjen,positif
3382,lahir jakarta balita jakarta tk sd tanggerang sd smk depok kuliah tanggerang abi orang kuningan jawa barat mama orang bandung kaya nenek pelupa banget pdhal muda,positif
3383,lahir depok jakarta papa orang riau mama orang medan padang indo iya papa bule iya kadang suka dipanggil cici kuliah binus iya indo semen papa bule bulepotan tertawa,positif
3384,lahir jakarta depok jakarta ayah jawa sunda jumat guru nak gaikut kebaktian ummm bu pakai gamis,positif
3385,lahir malaysia cilincing pondok ungu tambun manggarai kuliah depok kerja depok bugis bone bugis bone turunan chinese yaa cewek namanya yuda,positif
3386,kuliah abang univ bang panik univ depok unp bang iya unp jakarta anjing si abang percaya awkward lnsng tertawa ngomong - ngomong panik si abang boongin,negatif
3387,kalinya kemarin beli ditanyaiin eh bang abang rantau iya iseng iyaiin dimanannya abang dikepala terlintas nama depok bilang depok kuliah kerja abang,netral
3388,lahir jakarta depok papa orang subang mama orang bandung orang gede sd tangerang smp bogor lembang,positif
3389,lahir tk kuliah tinggal abang marga asuog,positif
3390,coxco anak depok mutualan yukk,netral
3391,kuliah dimana si enak banget kuliah depok anjing panas sumpem debuan dhsjsjsksk korona,positif
3392,lahir depok depok ayah orang depok orang jakarta orang jawa iya iya nama kayak laki,netral
3393,tanyarl ikutan bikin ginian ayo lahir jakarta depok jakarta papa orang aceh mama orang banten kelas kuliah iya bambank,positif
3394,lahir tangerang dimana bingung tk sd kls depok sd smp samarinda solo skg kuliah bandung papa asli boyolali mama asli jakarta pwk aslinya darimana,positif
3395,sch ppdb kota pgn ppdb jakarta depok yah,netral
3396,sch ppdb kota pgn ppdb depok yah,netral
3397,belani moro yk ancen biasane rene kali sebulan pas mantan study tour nang depok suwi kandas ajur jum,negatif
3398,lahir tangerang depok sd smp jakarta barat pasuruan kuliah jogjakarta kerja sidoarjo ngebolang melulu sihh gapernah dirumah,negatif
3399,lahir kendal semarang depok papa orng madiun mama orng kendal semarang wktu kli kenalan judes banget si iya maap,netral
3400,lahir bandung bandung pindah depok sekolah jakarta papa orang jateng lahir jakarta mama orang minang lahir jakarta jakarta kalimantan bandung chat marah tertawa,positif
3401,seru banget yaa cursing pakai bahasa daerah orang depok kuliah bandung lancar bhs sunda wkwkwkwk kesel banget,netral
3402,sebulan rumah kadang kluar lari komplek kmrin diajak jalan keliling depok jalan ramai coii warung kopi buka kumpul-kumpul ngerasa prank sebulan,positif
3403,susah cat wkwkwk lahir palembang tk depok sd sby smp smd semoga kuliah jogja papa orang jogja mama orang kediri keluarga netap smrg bilang orang smrg tu iya aneh,positif
3404,farida ppdb sejalan psbb depok depok news,netral
3405,lahir bogor depok orang depok orang depok anak si bandel banget bandel tertawa kuliah dimana semester fii pacar iya,netral
3406,relate kuliah nya depok rumah dijawa plosok beuuhh,positif
3407,lahir depok depok papa orang depok mama orang depok kelas dikirain smp seriusan melulu tukang gojek test pelajaran coba woi wajah menangis kencang,netral
3408,sch doain iya teman-teman semoga masuk depok jaraknya,netral
3409,sch informasi ppdb depok,netral
3410,farida ppdb sejalan psbb depok,netral
3411,bang orang lampung rantau depok pas masuk sekolah auto dibilang eh begal begal,negatif
3412,lahir majalengka majalengka kuliah kuningan bandung orang bogor tinggal depok orang majalengka tinggal majalengka panggil nya halen haln haleun helen holeun haleeenn hulk,positif
3413,lahir jakarta depok papa orang sidoarjo mama orang surabaya adekmu gedean adekmu iya yauda gtu jatah makan diabisin wajar adek gede dripada,positif
3414,lahir jambi sd pekanbaru smp dumai smk depok orang timur iya bang timur makan bang makan kotoran,netral
3415,lahir bandung depok papa orang semarang mama orang bandung smp kelas adik kamprettttt umur w kepala duaa,positif
3416,lahir jakarta depok ayah purworejo solo pas kuliah smrg bilang eh keturunan jawa sunda mbanya orang jawa kirain padang,positif
3417,lahir depok depok papa orang klaten mama orang klaten sekolah dimana bagus iya anak pinter,positif
3418,jakarta ribut sekolah sekolah ribut depok susah seneng nginjek injek bandung sia of wae kalawan antos pakansari solo bikin podcast make the world all right,positif
3419,lahir jakarta jakarta depok yogyakarta papa orang sunda mama orang jawa pindah sekolah rumah asrama rumah bude rumah rumah bude ngontrak rumah gada,positif
3420,lahir jakarta depok jakarta papa orang jawa gede jakarta mama blaster betawi sunda gede jakarta depok tinggal depok orang jawa bhs jawa sekolah jakarta depok sekolah,positif
3421,pesantren mahasiswa al hikam depok didirikan almaghfurlah kh a hasyim muzadi terletak kawasan kukusan teknik universitas indonesia diperuntukkan mahasiswa aktif kampus jakarta depok,negatif
3422,lahir jakarta jakarta depok papa orang ambon mama orang cirebon eh orang kristen iya mukanya kaya orang kristen oalah pantes tama masuk sekolah orang uang ajak sholat bareng,positif
3423,dengar informasi sekolah anak depok desember dirumah mudahan selesai pandemi corona nya dok,positif
3424,sch dom depok daftar depok japres jabar daftar japres dki masuk dki,netral
3425,sch daftar japres dki milih abistu daftar japres jawa barat depok milih,negatif
3426,lahir jakarta bekasi depok kuliah malang papa orang kuningan mama orang pekalongan suka nikahnya gus kujawab sabtu iya minggu,positif
3427,tanyarl ikutan bikin ginian ayo lahir palembang palembang papa orang palembang mama orang palembang kuliah depok orang jakarta uang medok daerahnyaa,positif
3428,lahir pacitan jatim jakarta depok papa orang jakarta mama orang pacitan jatim bahasa sunda si bhs sunda gara pas sd matpel bahasa sunda tetangga orng sunda denger bicara sunda,negatif
3429,lahir bekasi bekasi papa orang bekasi mama orang depok kuliah dimana,positif
3430,lahir pasar rebo bogor depok papa orang cilacap mama orang pariaman kuliah jurusan dimana,positif
3431,lahir bekasi depok bekasi alias pindah coy papa orang ambon mama orang jakarta kuliah dimana maap om tante buibu smp badan gede,positif
3432,lahir disolo depok papa orang betawi mama orang solo kuliah dimana masi,positif
3433,lahir depok warga depok kuliah ui depok pokoknya ui kota memberatkan orangtua biaya mahal,netral
3434,stasiun pulang pergi kuliah cek bogor cilebut bojong gede citayam depok depok pondok cina universitas indonesia universitas pancasila lenteng agung tanjung barat pasar minggu pasar minggu durian kalibata cawang tebet manggarai sudirman karet tanah abang duri angke,negatif
3435,lahir bandung bandung papa orang jawa mama orang bandung bisanya kuliah depok cari suasana nyet puas,positif
3436,lahir depok depok papa orang depok mama orang jakarta smp iya,positif
3437,lahir bogor depok medan kuliah bandung ktp depok papa padang mama betawi wujud nusantara,positif
3438,tanyarl ikutan bikin ginian ayo lahir jakarta jakarta bandung depok papa orang bandung mama orang bandung iya kuliah dimana mon maap,positif
3439,tanyarl ikutan bikin ginian ayo lahir depok jakarta papa orang minang mama orang solo sekolah mesir iya bhs arab iya sekolah disana,positif
3440,lahir depok tk depok sd depok smp jakarta depok kuliah depok orang tua jawa jakarta rumah terlambat melulu tertawa,positif
3441,lahir yogyakarta purwokerto ibuk orang jogja orang wonogiri kuliah jakarta depok tepatnya kerja merantau kesana kemari bang toyib orang batak rahang kotak,positif
3442,lahir jakarta jakarta sd smp jaksel kuliah alias lenteng agung tinggal depok arab iya,positif
3443,lahir malang depok papa orang jawa mama orang jakarta smp iya kelas soalna cilik kali coolyeah,netral
3444,lahir jakarta tinggal depok pasar minggu kuliah jakarta jogja papa cirebon mama jambi kerjanya kerja tv,positif
3445,informasi peserta skpp daring bawaslu kota depok memiliki skor penilaian minimal point pelaksanaan pembelajaran audio visual mei s mei,negatif
3446,lahir depok depok remaja jawa ayah medan depok belajar bahasa sunda sd amp smp bisanya bahasa jawa darah jawa,netral
3447,lahir bandung bandung mataram denpasar makassar surabaya depok jakarta nomaden lyfe papa orang sunda mama sunda lelah pindah ijazah sekolah amp mantan nya selindo indonesia banget iya,positif
3448,iyak tertarik mampir pas baca tulisan theatre nya kirain layar tancepnya wakakak depok timur dalem bekasi orang depok mas,positif
3449,sch teman anak smk swasta dki tinggal depok mutasi negeri dki,negatif
3450,ngayal crazy rich surabayan pas dikabari dosen jam kosong kuliah minimal helikopter mendarat rotunda jemput teman tersayang keliling depok cibubur taman mini,netral
3451,kebayang kuliah rumah puasa ujian bolak depok ciputat alhamdulilah,positif
3452,sch dongg kaliaan mendingan depok jakarta,negatif
3453,depok hyungg lulus smp masi si,positif
3454,mcd cinere depok dipenuhi mahasiswa upn nugas rapat larut malam,netral
3455,lahir depok jateng kuliah dipekanbaru bengkulu ayah orang payakumbuh mama orangb lintau pas q mata turun hati,positif
3456,mcd kelapa depok mahasiswa nya beli eskrim kentang pakai wifi nya jam misi dipesan,netral
3457,lahir depok yes the legendary city depok orang jawa lahir jakarta mama orang padang asli kuliah orang ras orang depok bingung orang mn,positif
3458,lahir bandung depok kuliah bandung papa orang cicalengka kabupaten bandung mama keturunan sumedang jakarta bandung bicara bahasa sunda,netral
3459,lahir banjar pangandaran depok ciamis papa orang ciamis mama orang pangandaran orang bilang kuliah dimana pacar non muslim iya namanya bertha ih cewek namanya pratama,positif
3460,lahir jakarta jakarta ciledug depok serpong w orang jember mama w orang purwokerto sekolah iya,positif
3461,lahir depok asli jakarta ayah asli wonogiri suka smp nya dimana he hehehe anj,positif
3462,lahir jakarta sd tinggal bekasi kuliah tinggal kos depok bingung rumahnya dimana,positif
3463,bicah orang asli orang blesteran lahir sekolah,positif
3464,lahir depok orang tua lahir jawa tinggal depok sekolah jakarta bahasa jaksel g bahasa sunda jawa maav,negatif
3465,lahir jakarta bandar lampung gede ngerantau depok kuliah jakarta ayah orang surabaya orang cirebon keluarga bandar lampung,netral
3466,lahir depok jakarta papa orang kebumen mama orang jakarta dibilang kerja kuliah lulus anj wkwkwk,positif
3467,lahir bogor depok kuliah medan orang betawi ayah orang mandailing skripsinya,positif
3468,mekdi singgah melepas lelah urus beasiswa rusia depok kereta ekonomi ilegal,negatif
3469,lahir dki iya dki jember bali bogor depok kebumen ayah jember ktp jember bogor sim bali tk dki sd smp jember bali bogor kuliah depok jawa iya tulen si bolang,positif
3470,aneh transisi semarang depok vice versa pas liburan kuliah semarang ngobrol teman teman kuliah mostly jakarta jabar too kemarin ik lt,positif
3471,lahir jakarta jakarta depok sd jakarta selatan smp jakarta selatan jakarta pusat kuliah mencari cerita dibandung kesampean iya ujung ujungnya jakarta mati jakarta diizinkan,positif
3472,lahir dijakarta jawa betawi betawi sd smp jakarta depok kuliah jakarta kerja jakarta nikah ponorogo tinggal bali hmm rumit,positif
3473,gampang sd smp angkot sd smp depok rumah parung angkot stasiun depok tidur dibangunin abangnya adik turun dimana terminal parung turun bang supir angkot inget wkwkwk,positif
3474,jaman rumah depok sekolahnya bogor lelah males bis naiknya angkot kejaksaan cibinong nyambung ngangkot rumah duduknya jalan tidur da perjalanannya,positif
3475,lahir didepok asli sukabumi sunda sampurasun kuliah jakarta ktp kota depok eh blasteran,positif
3476,percaya keluh kesah banget grgr dipisahin sd depok eh smp pindah gantian kuliah malang haha,netral
3477,sebentar ngomong - ngomong dom depok smp dmna asing,negatif
3478,lahir jakarta ktp ditulis bogor bogor kuliah depok kerja tangerang stay jakarta orangtua asli jawa orang betawi asli iya nis moonmaap orang pan pindah yak,positif
3479,lahir jakarta barat depok tk smp jakarta ambles depok ayah batak pride dibilang ko orang ambon yak,netral
3480,lahir depok tk sd kls tangerang selatan ngelanjutin sd smp majalengka smk cikarang selatan papa orang jawa mama orang majalengka mama nya putih anaknya hitam,positif
3481,sekolah islam terpadu nurul fikri depok,positif
3482,lahir medan kelas sd kelas sd depok kelas bekasi kelas jakarta kerja maunya batam si biar gabut singapur malaysia wqwq,negatif
3483,wkwkw apa-apa ih santai orientasi studi pengenalan kampus lahir bogor tinggal depok ayyy kuliah bogor he orang bogor,positif
3484,lahir jakarta jakarta depok papa lahir bogor mama lahir jakarta asli solo turunan cina muslim sm guru agama pakai jilbab jam,positif
3485,lahir jakarta selatan tinggal jakarta timur depok sekolah depok mama half japan half bali tinggal sragen half india half sragen tinggal sragen asli orang me,positif
3486,lahir kairo kairo semarang kuliah tinggal depok orang purwokerto orang semarang bingung orang,positif
3487,lahir boyolali boyolali ayah orang jawa aseli kerja depok kuliah jakarta kuliah,positif
3488,ehh serius menghirup udara depok kuliah,negatif
3489,lahir jakarta ciputat tangsel kuliah depok kerja cibitung rumah numpang goler kasur kebanyakan habiskan jabar,positif
3490,smp jakarta rumah depok depok gd masuk zonasi bismillah,positif
3491,jujur album cia dapetin album cia banget beli album uang tabungan kebutuhan kayak sekolah keluarga jadii cia berharap album giveaway hyung cia dom depok,positif
3492,ikutan hahaha lahir jakarta depok mama jogja jogja tk kuliah jakarta,positif
3493,wkwkwkwk pakai batuu bulatnya sempurnaaa sd depok bikin gituan kali iya,negatif
3494,lahir depok depok padang ayah orang padang orang jakarta asli cilandak ngawinin iya allah jaman sekolah gituan akhlak,positif
3495,lahir jakarta boyolali medan jakarta depok kuliah kairo orang boyolali mama orang dayak jakarta mesir orang mesir thailand malaysia china afghanistan,positif
3496,cita ui karen banget rumah bangett masuk kedokteran notabene favorit depok kesusahan ngejar snm kedokteran alhasil banting stir kimia ui,negatif
3497,nama almamaternya bikin beban bangga kuliah ui memilih depok,netral
3498,lahir jakarta masuk sd jakarta lulus bali masuk smp bali lulus jakarta bogor masuk kuliah depok lulus bogor bandung ayah jakarta chinese iya palembang bingung,positif
3499,ikutan lahir cirebon tinggal cirebon kuliah depok orang cirebon orang cirebon campuran anjing leluhur orang cirebon yawla dibilang liatinnya sinis banget w perasaan,positif
3500,lahir jakarta madiun smp klaten jogja lulus depok kuliah solo abah orang madiun umah orang padang sesok golek bojo endi iya penak e,positif
3501,sch anak depok senioritas anaknya nakal nakal,negatif
3502,jaman jaman fix anak depok tertawa,negatif
3503,sayangnya sekolah w depok nyerempet jaksel bocahnya gaya jaksel wkwkwkp,positif
3504,lahir depok tumbuh amp berkembang depok orang tua asli jakarta alias betawi tulen jakarta pas betawi asli kuliah bandung ditnya orang mna jwbnya bingung kdg depok kdg jakarta orang ngira orang jawa sunda,positif
3505,lahir jakarta usia tk jakarta sd smp jawa kuliah depok kerja tangerang asli jawa ayah orang surabaya asli sunda iya,positif
3506,pas kuliah depok tinggalnya tangerang depokers iya hyung,positif
3507,sman depok nder alternatif sekolah pesantren,positif
3508,depok keduluan iya pas smp jual ganja smp tertawa,positif
3509,lahir jakarta cikampek kuliah depok kerja cikarang orang pamanukan mama orang lamongan orang bali iya huruf namanya,positif
3510,teman mencar depok bogor bekasi ngumpulnya kokas,netral
3511,aw pskd depok,netral
3512,lahir depok asli caruban jawa timur depok kuliah kerja surabaya orang jawa bahasa jawa,positif
3513,lahir depok bogor sekolah depok bogor bandung kerja dapur sekolah dimana suster mengambil blood sample mcu contract,positif
3514,lahir sulawesi solo depok sd smp cilacap kerja bekasi kuliah jakarta nci belapa nci lau uwe olang chines nyablak bat luh orang betawi dahal keturunan rang solo mudik ca medan muka w batak banget,positif
3515,sch favorit depok iya,netral
3516,depok tertawa ih seangkatan gasalah pas sd,positif
3517,maret april membantu mahasiswa kost kesulitan pangan dimasa lockdown ransum nasi bungkus lokasi pondok labu depok bandung jatinangor denpasar never forget where you come from,netral
3518,mbak kosannya daerah depok kuliah,netral
3519,depok bang abang sibuk kuliah,positif
3520,sch perbatasan jaksel depok mentok margonda bagus iya,negatif
3521,pas kuliah sadar orang bahasa sunda kirain orang depok at least istilah bahasa sunda,negatif
3522,lahir magelang kaliangkrik kuliah depok bapake kaliangkrik mamake kajoran e ditanyain cina mas,positif
3523,sawangan basi dikirim margonda kena begal genk motor anak smp depok,negatif
3524,pengalaman pas utbk depok seneng banget ketemu teman tes adventure banget depok kali kereta menunggu berbuka puasa pusing ngerjain utbk utbk bogor wkwkwk pas puasa ramai banget menginap hotel,positif
3525,orang depok iya orang jaksel jaksel hadu tertawa orang bekasi gayanya kaya orang depok jaksel oohh tinggal dibekasi cilacap hahh iya sekolah pesantren hahhhh anak kaya pesantren apal,positif
3526,stan keyakizaka seoulsalita akb seoulsalita jakarta seoulsalita iz one seoulsalita depok kuliah ngidol mantap senang,positif
3527,akuuu dulunya ipa kuliah eko salah ptn depok,negatif
3528,lahir jakarta kelas smp pindah cirebon kelas pindah depok kelas pindah cirebon kuliah ciputat tangsel kerja jakarta rumah bogor orang enaknya iya,positif
3529,depok sekolah jakpus menteng matraman,positif
3530,kali colmek fingering pas sd kayaknya mantan stm stm kambul wkwkw orang depok cinere tertawa,netral
3531,acara nuzulul quran digelar pc nu depok daring,positif
3532,lupa pas jaman smp banget dengarkan lagu lagu anak depok,positif
3533,lahir didepok tk smp kuliah nde jember sd tok nang depok tmn kuliah anak jbr bahasane ono sing julid jarno ae gausa dengarkan,netral
3534,kuliah surabaya depok ketemu kangen banget peluk,positif
3535,pengalaman horor terlambat uts matkul semalemnya pelajarin smp berbusa rumah depok kampusnya kota jakarta bangun ujiannya selese langsung horor abizzz,negatif
3536,assalamualaikum terhormat ganjar pranowo penangguhan sragam sekolah kronologisnya warga depok jawa barat pantes tweet menampung warga beliau warga kelurahan sruwen,positif
3537,tk tunas pertiwi cimanggis depok kelas langsung kolam renang maap sombong nyata tertawa ulang rayain sekolah wkwkwk kali tk kuy reunian tertawa,positif
3538,lahir jogja ayah jakarta jogja tinggal bogor smp jakarta depok jateng,positif
3539,generasi akhlak pembukaan pendaftaran paskibraka anak sopan santun ig ppi depok bikin emosi,positif
3540,hahaha alias ditraktir woi masuk kuliah normal eh depok si kirain lulus kerja crb anjing,netral
3541,anak pocin blakang pnj anak kuliah situ suka illfeel dikatain anak depok tertawa,negatif
3542,lahir gede depok kuliah makassar ayah bugis mks dipanggilnya tetep sundel,positif
3543,at this time depok masuk kuliah online seminggu bingewatch film pendek gila gilaan ampe otak panas listened to some new songs as well lagu,positif
3544,perkenalkan muhammad dhiyaul haq mahasiswa s ilmu pemerintahan unpad penelitian berjudul persepsi publik efektivitas program joyfull traffic management jotram mengatasi kemacetan kota depok,positif
3545,lahir kuningan sd smp jakarta kuliah depok kerja bandung ayah pure sunda suka bingung,positif
3546,sd ganemu teman sd smnjak pindah sd depok sleman lulus angk,positif
3547,lahir banjarmasin tk a banjarmasin tk b sd smp gresik tangsel kuliah depok ayah pure minang ttep dikatainnya jawaakkk dikiranya jawakk,positif
3548,informasi pendaftaran siswa smpn depok,positif
3549,nak depok kuliah alias msih skola hyung,netral
3550,depok rawan begal maling kasian sunwo,negatif
3551,chatan kabar kesehatan kadang kuliah amp kerja nya depok laptop bilang upgrade ssd ram tolong depok sakit teman,positif
3552,tps daring maksudnya tps online kpu depok bikin tps daring kaitan pemilihan kepala daerah depok,netral
3553,inget namanya yoyo widhy prasetyo doni amir hendra sogir anak alhikmah bbrp anak depok sanur lupa ardian salah,negatif
3554,kemarin orang bandung utbk rumah iya pilih itb upi kuliah ui milih utbk disana tinggal depok pusat utbk nya ditentuin tes nya dimana,positif
3555,lupa mlm slamet smp muhammadiyah depok,netral
3556,aduh ew depok menempuh kuliah,netral
3557,salah satunya mbah noto setiko alm adiknya mbah h dul manan alm bebuyut paman david pulang smp lost kontak,negatif
3558,kali lihat kabut depok kayaknya jaman sd rada iya cm bbrp menit hilang is it a bagus sign udaranya membaik,negatif
3559,pgn kuliah depok aamiinnn,netral
3560,smp depok eh salah wqeq,negatif
3561,sahabat desari menyisikan rezekimu oarang membutuhkan bergabung sedekah drive thru tol depok antasari sd wib yaaa don t miss it,negatif
3562,jogja malang semarang depok flish kuliah depok,negatif
3563,maling begal jambret corona king prestasi depok,negatif
3564,kota impian kuliah bandung kenalan pengennya kuliah jogja jakarta depok bandung lepas surabaya cm kesini nyesel pilih surabaya faktor kepopularitasan universitas surabaya hati cie,negatif
3565,meychan maia ahmad lapangan brigif depok kelas ditipu teman sekelas peterpan manggung,netral
3566,this page really describes relationship medan endah depok seminggu minggu telfonan vc an bahas kerjaan kuliah politik pemerintahan ngobrol sejam anak minimal pagi,netral
3567,siang salah anggota bawaslu kota depok andriansyah s hai mengikuti diskusi daring awasi ayo serial tema kaya gagasan bermedia sosial,positif
3568,dapatkah money politic dihentikan raja faidz el shidqi mahasiswa fisip umj sekretaris deep kota depok,negatif
3569,kangen banget jaman kuliah depok bandung jam pulang pergi kampus jumat siang lsg ngacir pool cipaganti kumpul-kumpul halte nungguin bus pulang weekend bahagia,positif
3570,sedih kali makan mcd sarinah pas kelas sd berangkat depok sarinah naek cepat terbatas sepupu beli happymeal,netral
