,cleaning,sentimen
0,butuhkan wanita usia th th tb cm cm menikah penampilan menarik mudah beradaptasi domisili cibinong bogor depok pendidikan min sederajat s berminat hub kolom,positif
1,lulusan s pendidikan agama islam ngajar agama jenjang sd guru ekstra futsal smp depok guru les guru ekstra hadroh kalasan koki popeye chiken marketing snapart call center xl call center mandiri kemendesa nyambung malu,positif
2,pt valdo need driver kualifikasi pria usia max th pendidikan min wajib memiliki sim b b pengalaman driver expedisi menguasai wilayah pulau jawa domisili depok walk in interview senin jumat pkl rumah toko graha cibinong blok g jalan raya bogor,positif
3,siswa miskin depok bebas biaya pendidikan swasta negeri,negatif
4,penjaga stand roti gdc depok pria wanita maks pendidikan smk kirim lamaran lengkap rotihrd com hubungi sumber,positif
5,depok we are hiring for sales dtd ms kualifikasi pria wanita max th minimal pendidikan smk pengalaman sales marketing berpenampilan menarik target,positif
6,duta jepang indonesia masafumi ishii kuliah ui depok hubungan diplomatik indonesia jepang baca selengkapnya,positif
7,kakak asuh mahasiswa depok pendidikan terpenting kehidupan aspek kehidupan berhubungan pengetahuan dapatkan,positif
8,sosialisasi pendidikan pemilih pemilihan kpu goes to school lokasi tujuan kpu kota depok mengadakan sosialisasi pendidikan pemilih muhammadiyah depok berlokasi kelurahan rangkapan jaya,positif
9,riwayat pendidikan sd pribadi bilingual boarding school depok smp labschool depok akselerasi negeri bandung universitas ui program studi soshum ilmu psikologi,positif
10,kunjungan tim penilik dinas pendidikan kota depok homeschool tml evaluasi pelaksanaan sistem pembelajaran blended learning html emy prasetyohati m psi putri utami r,negatif
11,wujudkan siswa berkarakter sit ruhama depok gelar gebyar pendidikan,positif
12,kunjed amp outing kls xi it nurul fikri depok goes to bandung simak ikuti keseruan siswa siswinya kunjungan pendidikan outing bandung informasi paket kunjungan,positif
13,menjalani sekolahnya semenjak smp depok meneruskan jenjang pendidikan tingkat universitas indonesia menikah hanin salah perusahaan home design,positif
14,kuliah dibuka rektor ui muhammad anis m met balai sidang ui depok wakil dekan bidang pendidikan penelitian kemahasiswaan fisip ui prof dody prayogo hadir kuliah,netral
15,bertempat tinggal cipayung jakarta timur depok bekasi menempuh pendidikan berjuang universitas indonesia jurusan sastra indonesia,positif
16,komitmen bonet berkontribusi memajukan pendidikan indonesia kepercayaan ajang lomba kompetensi siswa tingkat kota depok,positif
17,lahir tpa taman pendidikan al qur an jakarta tk kelas depok kelas lulus smp bogor smk lulus,positif
18,blusukan wilayah depok lihat langsung sekitaran smp perihal pendidikan lalulintas mohon perhatiannya,positif
19,ratusan operator sd dilatih sop input data kepala dinas pendidikan kota depok,negatif
20,mengundurkan mengutamakan pendidikan kuliah filsafat depok kayaknya sokap iya,netral
21,masyaa allah praoud of bee alhamdulillah allah izinkan bianca juara lomba nyanyi anak tingkat sd memperebutkan piala dinas pendidikan kota depok terimakasih,positif
22,tantangan persaingan ketat kemampuan standar kalah standar menang menaker kuliah perdana mahasiswa program pendidikan vokasi depok,negatif
23,pagi menaker kuliah perdana mahasiswa program pendidikan vokasi tema penguatan jati pemanfaatan sumber daya vokasional depok,netral
24,nama hugo rafelian dirgantara nama panggilan hugo tanggal lahir bandung januari domisili jakarta depok bandung pendidikan universitas indonesia sastra inggris pekerjaan mahasiswa model vlogger,positif
25,dinas pendidikan kota blitar melarang guru pekerjaan rumah siswanya dinas pendidikan kota depok siswa sd smp bebas pr hore bandung,netral
26,pt anugrah analisis sempurna membutuhkan staff messenger kriteria a laki laki b umur maksimal c pendidikan smk sederajat memiliki sim c aktif e penempatan depok,positif
27,praktek amp kerja pendidikan vokasi pilihan dibuka pendaftaran mahasiswa politeknik lpi jakarta kampus depok gelombang,positif
28,kepala dinas pendidikan depok mohamad thamrin aturan pr siswa diterapkan ajaran,positif
29,kepala sekolah sman depok pungli rp juta siswa kepala dinas pendidikan jabar panik detak berita,netral
30,jawa barat depok bogor bekasi tingkat mengurus dinas pendidikan prop jabar usul benahi donk ppdb sman jabar perbaiki web dipakai biar transparan cepat diaksesnya,positif
31,alhamdulillah lentera insan mengutus guru guru sd mengikuti pelatihan diadakan dinas pendidikan kota depok s guru diutus moch taufan aini,positif
32,skuad persiwa kebanyakan berasal pplm pusat pendidikan latihan mahasiswa bermarkas sawangan depok,netral
33,semoga depok sampel data diperbaiki kebijakan zonasi ppdb infrastruktur kualitas pendidikan cc,positif
34,informasikan administrasi pendidikan smk sederajat dialih kelola pemerintah provinsi jawa barat informasi lengkap,positif
35,pengabdian alumni terbuka depok tkb cinangka pendidikan berbasis partisipasi masyarakat,positif
36,angkat tema paradoks pendidikan mahasiswa unindra luncurkan depok pos,positif
37,ceramah tarawih ust m yusron shidqi pimpinan pondok pesantren al hikam depok peran aktif pendidikan berbasis al qur an membangun peradaban nusantara imam tarawih muhammad ishaq mahasiswa fkm ui sekjend ldkn salam ui,positif
38,kepala sekolah pecat guru cabuli belasan siswa depok kepala dinas pendidikan,positif
39,sistem pendidikan dikota depok aaja ketahun ppdb bermasalah siswa jalur gelap kebanyakan bawa ormas dialih klola provinsi semoga ricuh tolong pedulikan guru honor,positif
40,shirokuma margo city depok need part timer sabtu minggu cewek cowo goodlooking jago jualan minimal pendidikan non hijab sistem shift disiplin amp pekerja keras minat kirim cv alamat email recruitment shirokuma com,positif
41,fban serius serius update relasi kaget percaya status relasi mengaminkan kejadian depok smp surabaya pendidikan bagus ritual agama patuh kerja ngo international kementerian profesional terorist,positif
42,dibutuhkan karyawati parttime toko metro kampus babarsari jl babarsari nomor komplek yadara caturtunggal depok sleman yogyakarta syarat jujur disiplin niat wanita usia max th pendidikan min smk sederajat kuliah min semester,positif
43,menaker menghadiri kegiatan pemasyarakatan hubungan industrial dunia pendidikan depok jumat kesempatan menaker mengedukasi siswa siswi amp smk kota depok hubungan industrial,positif
44,peningkatan pendidikan kota depok sesuai arahan pemerintah pusat unbk smp mts negeri amp swasta berbasis komputer pemenuhan kebutuhan apk sd mencapai amp smp upacara pendidikan nasional,positif
45,kerja pt tri unggul bogaindo distributor ice cream aice depok membuka kesempatan kerja sales urgent pria usia pendidikan min smk sederajat penampilan,positif
46,pelatihan guru bimbingan konseling kota depok upaya walikota meningkatkan kualitas pendidikan amp perbaiki akhlak siswa,positif
47,universitas negeri pendidikan agamanya cenderung iya sayang program liqa hence melahirkan fundamentalis denger teman kuliah salah universitas negeri depok,negatif
48,bupati sleman beserta kepala dinas pendidikn kabupaten sleman dra sri wantini m didampingi kepala balai pendidikan menengah kabupaten sleman mengadakan pemantauan unbk depok kolese adik brito senin,negatif
49,internal audit staff usia maksimal marketing support diutamakan domisili depok field collection pendidikan minimal sederajat,positif
50,april disdik depok gelar unbk smp dinas pendidikan,netral
51,tkt amp amp tgabung klinik pendidikan binaan r ridwan semoga prestasi draih penyemangat sukses,positif
52,pengambilalihan kekuasaan badan hukum diharapkan merevitalisasi pendidikan politeknik vokasional areal kampus ui depok jarang diminati lulusan cc,netral
53,ayo silahkan mampir rumah lihat memanipulasi semangat mahasiswa en pendidikan nutupi prilaku manusiawi memuaskan nafsu maksa bawa infrastruktur pemukiman warga depok ijin warga tengoklah videonya,positif
54,anaknya cewek kuliah s salah universitas terbaik indonesia daerah depok bahagianya denger anaknya pendidikan mandiri,negatif
55,semangati ikuti the th open competition tanggal maret pelajar amp tsbt berasal bogor amp amp dpimpin r ridwan slaku ketua klinik pendidikan mipa,negatif
56,studi banding relawan pendidikan sukmajaya depok terbuka depok tkb cinangka,positif
57,wuiiiihhhh serunya pembukaan bakti sosial pendidikan smp depok kelas inspirasi pendidikan reproduksi remaja games seru powered by penjahat kelamin arsa candradimuka lpdp,netral
58,yesha terpaksa tinggal depok urusan pendidikan kekurangan apapun yesha hidup mandiri kuliah yesha sukai anak anak bernyanyi berorganisasi,negatif
59,seminar parenting komite sd integral hidayatullah depok tahapan pendidikan anak al qur an al hadist moderatori,negatif
60,mengenal pristac informasi pristac lembaga pendidikan non formal setingkat naungan pesantren attaqwa depok muhammad ardiansyah pengasuh pondok pesantren attaqwa depok,positif
61,wakil walikota depok buka lomba pendidikan nasional sd tingkat kecamatan,positif
62,dinas pendidikan depok larang siswa rayakan valentine day,netral
63,profesional file nama tristan abiyyu wirasana nama p tris tan ttl bukittinggi februari pendidikan kuliah universitas bina nusantara jurusan teknik informatika jakarta depok hobi main game aktif organisasi,positif
64,ks sd swasta memajukan pendidikan kota depok,netral
65,news mendikbud susun kode etik guru siswa depok menteri pendidikan kebudayaan mendikbud muhadjir effendy berencana menyusun kode etik hubungan guru murid kode etik respons ata,positif
66,update kuliah lpi kampus depok,netral
67,c lokasi pusatnya depok jawa barat kementerian riset teknologi pendidikan kemenristek dikti universitas indonesia memiliki populasi mahasiswa mahasiswa,netral
68,dinas pendidikan kota depok gelar serah terima jabatan kepala sd smp negeri,positif
69,pendidikan politik usia kpu depok kedatangan tamu pelajar sd informasi digital,netral
70,dibutuhkan driver penempatan bank yogyakarta syarat pria maksimal th pendidikan min bertato bertindik hafal wilayah jateng diy mobil matic manual lamaran pt iss indonesia jl cermai caturtunggal depok sleman,netral
71,maaf historis pendidikan kuliah man depok,netral
72,disdik depok terapkan pendidikan karakter siswa depok,positif
73,ketua pkk kota depok menghadiri arahan kegiatan safari pendidikan politik siswa siswi negeri depok,netral
74,kuliah kerja rusia negara kawasan asia pasifik bidang pendidikan duta rusia indonesia mikhail galuzin selasa november wib auditorium gedung kampus ui depok,positif
75,pungutan sumbangan pendidikan diatur ps uu sisdiknas kepala sekolah depok,positif
76,dukung pendidikan zakat sukses launching terbuka depok,positif
77,acara sosialisasi pemahaman hubungan industrial dunia pendidikan dihadiri siswa siswi smk kota depok,positif
78,kunjungan kepala dinas pendidikan kota depok rangka monitoring pelaksanaan penilaian semester pemuda bangsa,negatif
79,pengawasan pendidikan kota depok ciptakan siswa berkualitas,positif
80,foto pengajian kelas smp depok implementasi pendidikan karakter berbasis masyarakat cc,negatif
81,visitasi asesor akreditasi smp hidayatullah depok komitmen memajukan pendidikan,negatif
82,mata pelajaran pendidikan agama islamnya sd merah melulu perbanyaklah majelis taklim,negatif
83,siswa mts negeri belajar lantai solusi disdik depok depok edunews id kepala dinas pendidikan,positif
84,kompascom orangtua siswa berunjuk balai kota depok tuntut subsidi pendidikan,negatif
85,butuh spg mobile area bogor depok kriteria wanita usia max th pendidikan min smp jujur disiplin,netral
86,mohon maaf seputar kegiatan pendidikan wilayah depok kemana iya,positif
87,subsidi pendidikan dicabut puluhan orangtua siswa unjuk dprd depok edunews id puluhan orang tua,negatif
88,kunjungan pendidikan smp lazuardi gis depok kamis juli more pict,netral
89,lulusan sd masuk smp kota depok,negatif
90,jadwal penerimaan siswa smp kota depok,netral
91,tingkat pendidikan kehidupan masyarakat mayoritasnya saudara kuliah diluar depok,netral
92,kewenangan pindah provinsi depok ganti peraturan daerah pendidikan,positif
93,lumayan mahal pendidikan vocasional depok smkn perbulan rb dibebankan ortua siswa,positif
94,sosialisasi penggunaan open journal system mahasiswa mei lab komputer gd pendidikan laboratorium fik ui depok,negatif
95,negeri depok selamat pendidikan nasional manusia berpendidikan,positif
96,selamat pendidikan nasional selamat ujian nasional berbasis komputer siswa smp arrahman depok,positif
97,karya siswa siswi lembaga pendidikan dikenal masyarakat kota depok,netral
98,kanvaser depok depok persyaratan pria wanita usia max pendidikan min sederajatnya,netral
99,diskusi pekanan mahasiswa stie hidayatullah depok diselenggarakan mentri pendidikan,netral
100,siswa smk kota depok mengikuti pendidikan pelatihan bela negara kesbangpol kota depok yonkav kostrad cimanggis,positif
101,upt pendidikan cilodong depok gelar lomba pasanggiri pendidikan agama islam sd,positif
102,berita upt pendidikan cilodong depok gelar lomba pasanggiri pendidikan agama islam sd,netral
103,kerja driver operasional penempatan depok pendidikan minimal sederajat pria usia maksimal,netral
104,depok percontohan program pendidikan keluarga ilustrasi murid sd kota,positif
105,kadisdik depok buka lomba pendidikan sd tingkat kecamatan sukmajaya cerdas amp berbudaya,positif
106,drs mulyadi m kabid pendas sada s kasie sd dinas pendidikan kota depok hadiri smart day,netral
107,monitoring pkks dinas pendidikan kota depok islam nurul qur an ciherang,positif
108,perumahan grand depok residence solusi pendidikan berkualitas putra putri depok kampus ui,positif
109,saallah pas iya at yayasan pendidikan nasional tugu depok pic,positif
110,kangen kelas at yayasan pendidikan nasional tugu depok pic,netral
111,dalih smun depok isu pungli orang tua siswa diam kebobrokan sistem pendidikan,negatif
112,smp negri depok sekolah mapel informatika,positif
113,bekasi negeri depok nurul fikri sekolah islam do cowonya ketahuan pacaran kaya didepok cancel banget,positif
114,anjing dunia sempit banget salah orang sekolah sejahtera depok,negatif
115,dekade sekolah masjid terminal alias master kota depok kian berkembang kelas kelas sederhana kontainer bekas klinik lbh tersedia peserta didik meraih beasiswa perguruan negeri,positif
116,outing pg amp tk madu pramuka cibubur pg tk sd sekolah alam akhdhor insan mulia alamat jl bungur raya nomor harjamukti cimanggis kota depok jawa barat jl,positif
117,surat edarannya kepala sekolah sd smp anak diperbolehkan,netral
118,konfirmasi alur pendaftaran smp negeri jakarta selatan sekolah sd siswa daerah depok kakak jakarta mendaftar smp negeri jakarta web lihat jalur zonasi non zonasi zalur afirmasi zonasi,positif
119,daftar sekolah sd smk terakreditasi a kota depok informasi persiapan ppdb,positif
120,sekolah sd flayover cibinong smp pakansari smk karadenan rumah depok carrefour cibinong,positif
121,outing kelas al izzah ragunan pg tk sd sekolah alam akhdhor insan mulia alamat jl bungur raya nomor harjamukti cimanggis kota depok jawa barat jl bungur,netral
122,marak tawuran kota depok aleg pks sekolah sibukan siswa agenda positif depok news,positif
123,marak tawuran kota depok aleg pks sekolah sibukan siswa agenda positif,positif
124,bidang intelejen kejaksaan negeri depok mengadakan kegaiatan jaksa masuk sekolah jms dilaksanakan sman kota depok kegiatan teresebut ikuti orang siswa selasa,positif
125,selasa februari unit bimas polsek depok timur melaksanakan giat sambang pemantauan siswa siswi sekolah mtsn ditemui wakil kepala sekolah bidang kesiswaan bp warsun munawir sag,positif
126,dikirimin foto anak smp berangkat sekolah jam pagi sekolahnya pluit rumahnya simpangan depok semangat yaaaa adek,positif
127,cerita dikit masuk smp depok sadar iya otakku standar wkw eh taunya masuk sekolah guru iya honorer wkw,negatif
128,wali kota depok mohammad idris mengunjungi sekolah hijau smp pgri depok kelurahan mekarjaya sukmajaya minggu kesempatan wali kota depok menerima pohon kurma hasil pembibitan kebun smp pgri depok,netral
129,aksi berani bocah sekolah dasar sd menggagalkan percobaan perampasan sepeda motor cinere depok viral media sosial peristiwa pelaku mengancam korban senjata tajam,positif
130,terhormat tugas sekolah sman depok berat sakit jiwa akibat permendikbud sekolah kaya sarang setan siswa tingkat kesurupan,negatif
131,berkesan nyakitinnya iya kejadian berulang sd depok ramadhan bayar zakat fitrah sekolah ditolak salah penerima zakat inget banget rb dianter kerumah,positif
132,pas sekolah berangkat ongkos bis depok bogor menunggu pinggir jalan menunggu bawa dagangannya pisah rumah ketemu uang ongkos rb bis pulang pergi ketemu pulang rumah,netral
133,seksi intelijen kejari depok melaksanakan kegiatan penyuluhan hukum program jaksa masuk sekolah jms negeri depok tim jms kejari depok wakili pilih kasi intelijen kejari depok arief sh mh siswatiningsih sh iwan sh devi sh staf intelijen,negatif
134,kating cerita teman seangkatannya sekolah kenal orangnya pas ketemu depok tanyain kuliah dimana nya mengaku ngeliatin identitas palsunya pas periksa tasnya eh ketemu beceng mengaku keterima stin,positif
135,besok senin iya btww prnya kapaan tertawa ngomong - ngomong kuliah sekolah ate a lot of foods here finally after months of craving indonesian foods lidah depok bangeet tertawa,positif
136,ceritaa hubungan cowo namanya medan kuliah ui jurusan management informatika semester salah sekolah kelas kelas kos depok rumah jaktim,negatif
137,sekolah mewah fasilitas modern murid apple depok madrah aliyah apple ampe ge brand apple prestasi juara robotic inter amrik mexico b,positif
138,kadang suka ngerasa sedih akrab teman teman sekolah pas smp terpisah gajauh banget teman depok tangerang iya pas ngadain,positif
139,kasubnit regident polisi wanita satlantas polres metro depok membantu penyebrangan warga anak sekolah sd pondok cina jalan margonda raya,positif
140,sd rebu kelas kelas rebu smp rebu sekola halim rumah depok habis ngangkot gasempet jajan rebu berangkat amp pulang sekolah jalan kaki an yah namanya idup pait ditelen,negatif
141,aa susah suruh mandi amp bangun sekolah aa susah lulus suruh shlat depok cuacanya mendung cerah dikit,negatif
142,jaksa masuk sekolah kejari depok memotivasi cegah penggunaan narkotika siswa,negatif
143,smp viednam vinggiran gila depok enam sumpah apan panjangnya swiss sekolah wilayah sampah anjing sekolah nyempil melulu angkot,netral
144,jaman dom depok sekolah jaksel,netral
145,penyuluhan hukum program jaksa masuk sekolah dilaksanakan tim intelijen kejaksaan negeri depok ikuti orang siswa narasumber kegiatan orang jaksa siswatiningsih sh iwan sh eki moralitas sh mh devi sh,positif
146,kejaksaan negeri depok melaksanakan kegiatan jaksa masuk sekolah jms sekolah menengah negeri kota depok,netral
147,salah sekolah impian semoga masuk depok doain iya gesss gambatte,netral
148,soreku ambyar judul tulisan magrib guru disalah sekolah swasta daerah depok sehari berangkat jam pagi pulang sore pertemuan dadakan beasiswa jerman guru,positif
149,dikunjungi siswa siswi sekolah dasar sekolah menengah kawasan depok jawa barat,positif
150,try out smp muhammadiyah depok terima kasih ucapkan panitia kepala sekolah kesempatan myroti yogyakarta bekerjasama sukses,positif
151,iya kuliah depok iya pulang sekolah s iya suka riset iya hidup,positif
152,depok banget ngelewatin sekolah sabar yaaa parah banget typo nya smpe salah,netral
153,sekolah swasta tk katolik depok moots orang depok nebak heheheh alumni sekolah,positif
154,sd banget kakak kelas kelas sd kesurupan gara suka penasaran main jalangkung sekolah sekolah swasta katolik depok kuburan mmg lokasinya lihat guru ngelarang kelas kelas,negatif
155,sarapan mie goreng telor pakai kimchi zaman sekolah sd jajan sd rupiah kuliah ciledug depok,positif
156,one day trip to cirebon liburan sekolah komite guru sd sn pemuda bangsa kota depok mengunjungi cirebon alhamdulillah team divisi tour amp travel dipercaya,positif
157,prestasi tertinggi w juara sekolah depok angkat depok nya hahahahahaha,positif
158,dijual rumah area citayam lokasi bebas banjir dkt st citayam dkt rumah sakit sekolah minimarket mall jl pemerintah daerah jl raya bogor akses mobil tol depok amp jagorawi surat ajb shm lt m sd m dp harga cicil tnp bunga harga rp jt sd rp jt,positif
159,dijual rumah area citayam lokasi bebas banjir dkt st citayam dkt rumah sakit sekolah minimarket mall jl thr beriman pemerintah daerah jl raya bogor akses mobil tol depok amp jagorawi surat ajb shm dp harga cicil tnp bunga harga rp jt sd rp jt,positif
160,depok tetangganya ayutingtong dewasa linenya yuna line kuliah sekolah,positif
161,nilai indeks pembangunan manusia ipm kota depok salah indikator ipm sekolah rls nilainya lulusan smp tingkatkan penduduk depok usia lulusan,positif
162,kemarin wawa presentasi kantor perusahaan negaranya om erdogan cari sponsor kegiatan sekolah taman nasional ujung kulon kegiatan lomba siswa inklusif tingkat sd depok,positif
163,me at home nomor one would know lulusan pondok hk me at work mas depok mas dimana kuningan jawa barat mas iya sekolah boarding mas ooh pondok iya kuningan hm hk iya ehe sh t here we go again,positif
164,mi al muhajjirin depok mi muhammadiyah sidobasuki mts daarul maarif natar muhammadiyah metro nya sekolah,positif
165,siswa smk depok terlibat tawuran masuk mal polisi merazia sekolah mengamanakan pelajar,positif
166,bang namanya dimas umur thnan kelas sd disdn ponter depok brangkat sekolah berangkat ngaji dikasih uang jajan keluarga orang tuanya meninggal nya pas umur posisi skrng tinggal neneknya kuli cuci,positif
167,tk wijaya kusuma sd sdn lenteng agung smp smp negeri lenteng agung negeri srengseng sawah kuliah adm keu adm niaga fisip ui depok sekolah mengarah depok basis kereta,netral
168,kasubag hubungan masyarakat polres metro kota depok akp firdaus delapan siswa sekolah mengaku terlibat aksi tawuran,positif
169,bismillah dibuka pendaftaran peserta didik smp muhammadiyah depok angkatan sekolah juara iya muhadesta tempatnya,positif
170,tingkatan jarak kantor kampus ui depok kantor kkn kantor rumah cimahi iya iya iya sd jarak rumah sekolah nyampe menit berharap jauhan biar ngerasain eh dikasih,positif
171,coba moz depok salon langgananku jaman kuliah cabangnya promo traveloka jumat potong rambut bayar seikhlasnya donasi sekolah anak yatim,positif
172,news terkini ipredator seks reynhard alumni negeri depok kepala sekolah predator seks reynhard sinaga divonis seumur hidup memerkosa puluhan pria manchester inggris reynhard,positif
173,sumpah kesel banget lihat headline berita kaya correlate banget kepala sman depok kuliah doctoral beritanya nya beritanya skrng ganti kepala sekolah kesel banget,positif
174,kepala sekolah sman depok reynard sinaga menunjukan prilaku menyimpang heran diwawancara kepala sekolah nya banget kepala sekolah kenal langsung bin banget siswa nama jarang anjing,positif
175,pria inggris korban reynhard sinaga kepala depok sekolah sepengetahuan anaknya gejala prihatin,netral
176,melacak sman depok prilaku reynhard dilacak smp sd tk paud r sekolah ui bikin pernyataan malu prilaku menyimpang akibat bawaan lahir,positif
177,smp smanya sekolah unggulan depok wkwkwkwk keos,positif
178,dibuka pendaftaran lomba perkusi ember bekas tingkat sd depok memperebutkan piala bergilir walikota depok terbatas untk sekolah ayo buruan,positif
179,reynhard sinaga divonis seumur hidup inggris kepala depok beberkan sikap pelaku sekolah,positif
180,habis pikir iya mohon maaf kepala sekolah sman depok ganti iya,positif
181,reynhard sinaga mata kepala sekolah negeri depok,netral
182,kepala sekolah nya depok tinggal teman sebangku walikelas nya habis,positif
183,iya wiinn teman sekolahnya teman suami ternyataaa smp nya sekolah unggulan depok gildaaaa nicsap diincer laah,positif
184,ketemu teman sd pas sekolah depok,positif
185,assalamualaikum maaf tmn guru smp yapemri depok iya guru sekolah qta yahh mohon infonya,positif
186,sekolah smp ngadain reuni akbar ngmgin desik kali yak ketemu myday depok ajani smpnya samaan,positif
187,masuk smp pakai pindah kakak zonasi kuotanya orang rumahku sekolah depok terpaksa pindah kakak hasil alhamdulillah nilaiku tetep masuk pindah kakak,positif
188,kelas sd pindah nanggung menunggu uas memutuskan ngungsi rumah nenekku depok sekolah depok bekasi angkot berangkat subuh pulang malam,negatif
189,inget smp kbanjiran an rumah depok skolah setiabudi jaksel bangun brangkat shubuh sekolah kbanjiran beda beda tanggungjawab diposisi beliau pilih ijin,netral
190,salah teman smp sawangan sulit pulang pergi sekolah depok musim hujan deras spot banjir,positif
191,hehehe habis teman smp sekolah sekolah top depok rank pararel nya rank pararel ayo puter tertawa,positif
192,kawanku irsal menamatkan medan melanjutkan studi fisip unas alm terkenal kritis pembela teman sejati ramah mendirikan sekolah anak yatim depok selamat jalan wak in shaa allah surga,positif
193,"flashback pas sd smp depok in general sekolah jadwalnya rabu pramuka kamis batik jumat koko smk bogor rabu batik kamis pramuka ketuker rabu kamis seragam salah outfit sadar pas on the way , jalan masuk bogor lmao",positif
194,kunjungan siswa siswi sekolah alam studio alam tvri depok kantor lazismu kota depok mengenal zakat infak sedekah diiringi presentasi anak anak pemberian kenang kenangan,positif
195,ikutan iya dom depok cash beli printer lumayan beli bagus butuh banget kakaku skripsi adekku sekolah insya allah kuliah terima kasih sblmnya,positif
196,sd suka jalan kaki sekolah rumah depok adem,positif
197,melaksanakan kegiatan penilaian semester ganjil murid sd integral hidayatullah depok melaksanakan kegiatan class meeting menanam pohon disekitar lingkungan sekolah,positif
198,pisah jarak sekolah depok si kaltim ketemuan susah tetakhir kontekan,netral
