,cleaning,sentimen
1586,terserah bicara tetep nakes stress anaknya keterima negri temennya sebelahan depok bekasi bogor tenang mikirin sekolah anak,negatif
1587,skinnyindonesian anjing jaman smp ampe pindah depok kuliah ui biar ketemu kajo sm andovi special terima kasih kajo sm dovi gaperna tinggalin kontennya smp,positif
1588,uny ppl penjahat kelamin depok bbc,negatif
1589,dahlah anak depok berbakat sekolah,netral
1590,depok tk sd smp yayasan elite hmmmm,positif
1591,hmmm depok tuh,netral
1592,depok les bimbel enaknya cepat nangkap iya sch,positif
1593,iya garage sale anak kosan mahasiswanya depok sepi ui kuliah tatap muka,negatif
1594,kakak deean alumni smp depok,netral
1595,halus aslinya tertawa kenal ngomong - ngomong kuliah depok orang depok asli,positif
1596,orang orang follow tinggal depok lari pagi ui margonda tinggal apartemen margonda kuliah depok tinggal kos wisma kornelius pecel lele lela margonda,netral
1597,siang maghrib nemenin si sulung depok mengambil barang barang kost semester ui kuliah online sayang bayar uang kost ditempati pamit,positif
1598,cbbr dmnna kakk depok pas kuliah si skrng kulon bogor wkwkwk,positif
1599,niat kuliah wilayah jabodetabek macetnya medan pusing macetnya depok kalopun ikutan keterima tertawa,positif
1600,yes bbrp tender bp buku gratisan kemendikbud si buku penerbit swasta pakai yudhistira sm penerbit lokal depok penerbit komite sd w tertawa,positif
1601,sch maaf out of topic anak alhamidiyah depok cari teman sd makasii fitur bookmark like rep out of topic nitip jualan lain-lain block,negatif
1602,bu depok efisien dipakein sistem zonasi smp negrinya merata wilayahnya berkumpul wilayah skolahannya,netral
1603,depok iya zonasi berdasarkan jarak rumah sekolah zahra,positif
1604,rumah jaksel sd smp depok jaktim pndah jaksel,positif
1605,jawa timur angka kuotanya jawa barat orang depok bekasi tenang anaknya masuk smk negeri,netral
1606,kuliah bandung niii depok ghe,netral
1607,salah disyukuri hidup sekolah smansa depok ketemu orang teman mainnya lingkungan,positif
1608,orang tua bandingkan sistem ppdb dki depok jakarta pakai umur,negatif
1609,idris terhormat warga depok kesulitan mencari sekolah negeri berbasis keagaaman min mtsn man tolong dibangun sekolah sekolah depok kota religius,netral
1610,sd bsd cma kls habis pindah dpk lulus sd smp depok lulus bogor lulus kerja medan hmmm kaya hidup penuh merantau,positif
1611,sumpah kemusuan ppdb jakarta amp depok,positif
1612,pagi brou salfok sd ngomong - ngomong sd depok si,netral
1613,si gais w diterima sekolah negeri depok,positif
1614,buka kosan depok guanya lulus kuliah hmm,positif
1615,antum percaya berita iya belajar gaul cari teman nakes orang grup nakes ramai jakarta menangis daftar sekolah depok bekasi bogor keterima duluan anaknya ppdb zonasi dibuka saran,negatif
1616,rangkuman top berita terpopuler penggerebekan kumpulan remaja depok alat kontrasepsi gubernur anies baswedan menyelesaikan ppdb jakarta,netral
1617,depresi feb ui feb unair maba akun sub tertawa hihi jam motoran malang depok berasa sekolah full time asistensi all day habis jalan rumah blek sek tidur repeat,positif
1618,jual sticker jaga jarak sticker social distancing sd rcti,positif
1619,seruan aksi lanjutan senin juni jam kampus depok almamater pakai masker lakukan aksi menjalankan protokol kesehatan hidup mahasiswa hidup mahasiswa gunadarma,positif
1620,ih depok kuliah offline mampirrr,netral
1621,anak tebet banyk banget calon anak depoknya admin anak smandel versi anak ny anak depok,negatif
1622,jalanan depok sekolah cakra buana smpai arah parung rombongan vespa parkir dipinggir jalan bikin macet jalan ugalan spion knalpotnya polusi mohon dipantau mengganggu,netral
1623,ujian kompetensi keahlian smk genesis medicare depok tim bbpkp tim bidang pengujian sertifikasi produk penilaian kegiatan kegiatan diikuti orang siswa smk medicare depok bertujuan menilai,positif
1624,welcome to depok indeed hidup sekolah jam jam keringetan gara panas pintu neraka dibuka pagi,positif
1625,gur pas korona tok sat nek dekne sekolah neng depok dadi anak kota makane gaya hidupe rodok kmprd,positif
1626,tmen tmen rekomendasi swasta daerah jaksel depok mahal bingit,negatif
1627,serius isi survei ituu anak depok bla bla gopay ovo gocap beneran notif masuk gocap senggama,negatif
1628,sch haloooo mahasiswa ui tingkat nyusun skripsi butuh bantuan siswa depok isi angket berkenan bantu rep yaa makasihh,positif
1629,help haloooo mahasiswa ui tingkat nyusun skripsi butuh bantuan siswa depok isi angket berkenan bantu rep yaa makasihh,positif
1630,depok segini biaya kelas sd sbmptn disc lunas juni pendaftaran booking adik dilunaskan maksimal tanggal juli,netral
1631,jakarta permasalahannya usia jalur zonasi depok permasalahannya prestasi rapot diduduki sd sd swasta sd negeri terseok seok cenderung berani kasih nilai rapot,netral
1632,lihat pengalaman membekas benak ata menginjak kelas pindah depok belajar uang ribu rupiah harganya dikumpulkan,netral
1633,depok ppdbnya kocak smp peminatnya verifikasinya banget jam pagi diverifikasi jam malam kemarin jalur rapot,negatif
1634,yaallah budak kenten awkakwkakwa kawan jaman sekolah sano aaaaaa tgr ye biaso pergi kampus depok aaaaaaa lamo tgr,netral
1635,depok kuliah uwiw,netral
1636,beres pindahan kosan ade depok eh nemu nescafe dikasih notes seumur w pas kuliah iya,positif
1637,sch gais diterima depok daftar jakarta jalur dki,netral
1638,sch berpeluang masuk fk ui snm jakarta jakarta sman depok iya,negatif
1639,uang kuliah situ jogja adek depok cocoklogi spekulasinya bandung ditakdirkan nyaman pulang kuliah definisi bandung beda,positif
1640,libur sekolah depok citayem,positif
1641,hai open po kemeja sehari cocok kerja kuliah amp hangout pengiriman rabu juli depok jabar bahannya katun rayon adem banget harga tertarik silahkan reply iya thank you,positif
1642,ceritanya situ libur kuliah pulang depok ngajakin berenang suka berenang berenang sentul,positif
1643,depok habis ujan jalan raya jatinangor selamat smp ikopin bogor dalem unpad habis ujan,positif
1644,selamat pagi min kriteria ppdb smp jalur prestasi akademik yaa cc,netral
1645,cek clear zonasi prestasi sekolah dki iya utamakan dki urusan orang bogor depok sekolah dki bodoh langsung tolak suruh bikin sekolah dilarang pindah daerah kecuali pindah rumah sanggup doank,positif
1646,jaman kuliah jogja weekend kosong pagi sarapan soto seberang st lempuyangan iya jogja bnr mengslowdownkan hiruk pikuk depok males nongki depok jakarta stress jalan boros mampus,negatif
1647,kuliah semarang kebawa po nya teman depok suka bingung bicara po mudahan bingung,positif
1648,alhamdulillah libur sekolah tetep belajar bagus job nak depok,positif
1649,kuliah depok pas orang bilang stapler hekter,positif
1650,eeee santuy bos depok smp anjg pagi ampe nyenget banget baunya,netral
1651,lahir bandar lampung sd jakarta smp depok kuliah bandung keturunan blaster jawa padang wkwkwkwk orang jujur suka bingung bahasa bhs ind eng bhs daerah,netral
1652,masuk jogjes masuk smp palembang depok,negatif
1653,sekolahin alm ayah alm mami tk perumahan anak gadis sekolahnya pas kuliah hm tersesat bekasi tamat kuliah eh kerjanya depok stuck disitu namanya depok depok timur,positif
1654,waspadai dbd sd depok lakukan penyemprotan fogging,netral
1655,adiiku masuk depok bagus luck iya,positif
1656,ppdb suruh wan abud belajar tetangganya depok tangerang ppdb,negatif
1657,work didaerah bogor depok lulusan gaes kuliah bantu keuangan keluarga,positif
1658,anjriitttt bkan smp tertawa ngomong - ngomong dom depok,positif
1659,jatijajarrr depok nya smp,netral
1660,kos depok jaman kuliah mei tertawa habis lulus kesana,positif
1661,informasi data pendaftar jalur zonasi negeri kota depok kosong,negatif
1662,pemasangan spanduk kapolsek depok barat kompol rachmadiwanto sh ucapan selamat bhayangkara bca jl lasksda adisucipto yogyakarta hotel atrium primere jl laksda adisucipto yogyakarta smp,positif
1663,cabang depok besok sabtu juni pkl wib smp terlambat yaa,netral
1664,sejutu euy adek sepupu w mayan pinter smp depok rank jalur zona orang tua dukung alasan kejauahan takut anaknya bersosialisasi mesti push orang,netral
1665,otak sistem aturan ppdb dki jalur diseleksi usia usia th keatas lolos fiktif tu nilai raport dipake jalur prestasi kouta cm sekian ribu peserta ppdb tangsel depok jempol banget,negatif
1666,edc kesel banget anjing gaboleh mandiri yujiem ayah alasan biaya kuliah jogja mahal as long as jaga keuangan tu biaya idup murah mahal depok banget keterima ui anjing cont,negatif
1667,sch tertawa banget scroll ig post an go depok eh taunya post annya testimoni mantan orang disuka pas sd,positif
1668,rabu juni pembagian rapor kenaikan kelas smp muhammadiyah depok t a standar protokol kesehatan covid smp muhammadiyah depok,negatif
1669,siang w berangkat kuliah iya siang siang w ngalamin kejadian horrornya w st depok krl jakarta bogor pas duduk w pasang headset dengarkan lagu tidur wkwkwk,positif
1670,ngomong - ngomong w pengalaman horror krl jakarta bogor ceritanya pas w masi pulang pergi depok bogor kuliah tetep ajakan naiknya krl jakarta bogor bedanya w st depok,positif
1671,warga depok doyan dangdutan ps kuliah jaman madk kosan depanny kebon luas pas an dipake dangdutan siang malam malam disitu culture shock warga kutek sunatan kosan hajat,positif
1672,makasi ngadain semoga berkah bismillah king bedah kisi un ipa dom depok,positif
1673,gais orang depok daftar ppdb depok jakarta tu g si jakarta pakai dki,netral
1674,mas jogja oke depok isinya masyarakat berkendara sembarangan kemacetan margonda dunia perngewean mahasiswa ui peredaran ganja,netral
1675,sd seribu sd rb naek angkot depok pasming pulang pergi smp rb smk rb,netral
1676,sosialisasi peran fungsi bawaslu memperkuat koordinasi kapasitas divisi bawaslu kota depok upgrading daring,positif
1677,sch sekolah fav depok margonda,positif
1678,work mahasiswa tingkat umur th jurusan psikologi aslab kampus guru les setaun administrasi alat tes psikotes x magang cari informasi magang kerja depok jaksel jakpus mohon infonya cont,positif
1679,pendaftaran smp depok jalur prestasi akademik nilai rapor maksimal pendaftaran pemasukan data nya jam iya batas maksimal juni,positif
1680,wkwkwk ketebak jegat oiyaaa dirumah si planet bekasi suka main depok kuliah disana tertawa,positif
1681,min pengajuan anak jam selesai diverifikasi jam nomor pendaftaran ppdb smp depok,netral
1682,kampus unsoed rajin ui suka kereta ngelewatin depok kuliah tangerang apa-apa dikasih allah kasih,positif
1683,teman kasih istilah melrose place kos kontrakkan bebas dki depok hunian lingkungan relatif jarang amp mahal unpublish melrose place lifestyle or livingstyle,netral
1684,sch sekitaran cibubur depok alumninya diterima ptn biaya nya gaterlalu mahal iya,positif
1685,gamaaaauuuu t t iya iya buatin iya kirim depok semangat kuliah aamiiiiin motivasi belajar bikinin gantian kirim bandung iya,positif
1686,kejadian depok cerita teman w anak jalur program pemerintah lupa namanya ngikutin pelajaran serba salah w bingung solusinya penyamarataan kualitas sekolah kali yaa iya,positif
1687,sch labschool cibubur smait nurul fikri depok,netral
1688,hai min japres raport kesaring salah smp dipilih pilih smp iya terima kasih min jabar depok smp japres raport,positif
1689,sch ppdb depok komen dibawahhh,netral
1690,pindah sekolah jakarta depok,positif
1691,polisi wanita melaksanakan giat pengaturan lalulintas pos sd pondok cina margonda depok bantu penyebrangan warga,netral
1692,gadis boyolali bersekolah depok menemani nonton tanding peduli jam tayang layar kaca berkat kedekatan kebiasaan spiritual,positif
1693,binder jaman terwat rapih,negatif
1694,depok jabar bedah un ipa,positif
1695,w kuliah depok diizinin merantau yogya feb ugm sadar teknik industri itb angan saking bodohnya w fisika depok wkwkwk tolong pilih walikota depok iya,positif
1696,smp banget rumah nenek perumnas depok ii jalan kaki mager ye siang siang bakar kalori angkot kadang ngiderin sonokeling tertawa mampir rumah nenek laper kebelet cucu oportunis akutu,positif
1697,almamater nya smp cimanggis depok onar sekutu bagus kayaknya banjir,negatif
1698,kuliah depok tinggalnya alias ui wkwkwkw,netral
1699,jakarta depok kabar gamasuk nalar gajadi sekolah lahir desember,positif
1700,cerita gais swasta bagus depok iya,positif
1701,sch depok tolak smait nf depok bagus,negatif
1702,masuk gundar masuk kampus kampus bebas pokoknya daerah adem macet tongkrongan murah pola pikir mahasiswa yuji kuliah depok,negatif
1703,lihat juknis jabar kli maksimal umur skrng jabar buka jalur zonasi demo krna lihat umur dftr kcuali orng mndftr sya saudara msuk dki jakarta tangsel depok dki jakarta membuka data,positif
1704,min mnggnakan jasa lion parcel regpack depok tujuan tasikmalaya resi bppqxsb tanggal sd sya cek resi barang smpai tjuan terima kasih bkan smpai alamt sya sya mnerima pketanny mohon bntuanny min thxs,positif
1705,sch swasta depok mahal iya,netral
1706,teman kasih istilah kos kontrakkan bebas dki amp depok melrose place,negatif
1707,sch hai sahabat rekomendasi bagus depok plis rep,positif
1708,sch nf depok depok iya,netral
1709,sipp twt mu ketahuan temenmu cowo kuliah depok jogya uni tambang alor fakultas sosial cowo hpnya iphone lacak list temenmu gampang nemu nder,netral
1710,selamat siang nama aziz nomor un anak terpakai pagi apply ppdb depok apply pagi,positif
1711,web nya iya barang kali web ppdb depok tangsel,positif
1712,teman-teman ppdb kota depok kota tangsel web kaya dki iya,positif
1713,mangga kang rezvan kelahiran asli bandung keluarga tinggal depok rezvan kuliah jakarta,positif
1714,hyung uang makan karyawan hidupin hyung teman kuliah kampus gede kayak depok jogja mahasiswa kayak lumayan,netral
1715,sch dom depok pilihan sekolah sman sman iya bimbang,positif
1716,sch teman tinggal depok kakak nya bogor daftar sekolah depok jalur zonasi iya kakel makasii,netral
1717,sedih banget daftar depok,negatif
1718,kelapa depok sekolah sm main daerah sanaa,positif
1719,ade sd jagakarsa smp tebet tinggal depok wkwkwkw kasian bgttt,negatif
1720,nitip mas jual tanah pribadi luas tanah m daerah kelapa depok persis dpn jalan raya dkt mako brimob kampus gunadarma ui cocok banget buka usaha mahasiswa kendaraan lalang buka harga jt meter nego dikit,positif
1721,enak banget depok jakarta kuliah pakai zonasi,positif
1722,pas sekolah rumusan perintah allah nomor berbuat cabul iya dilarang depok,positif
1723,urusan sekolah ribet masukkan anak banget pilihan ketje depok sekolah nya rustam ketje pertimbangan alhamdulillah lanjutan nya kemana,positif
1724,ukuran small sedeng hamba beli tusuk isi bakso rb sd depok gede tusuk isi bakso gede harganya rb include saos pedesnys dioles,positif
1725,twitter please do your magic kereta distasiun depok tolong lihat mas beli dagangannya iya jual nasi kucing murah banget ribu pas dagang bayar kuliah ayo teman-teman bantu mas bri,positif
1726,web daftar depok yaaa,netral
1727,kasian sman depok anak tiriin gegara gedung namanya ampe uang pilihan sekolah,netral
1728,latar beda beda mahasiswa pengusaha karyawan swasta pegawai negeri sipil berasal wilayah berbeda jakarta bogor ciamis depok jember sumatera utara,negatif
1729,depokk cmn kemarin keterima ppdb depok wkwkwk ppdb jakarta,positif
1730,ui gunadarma mercu buana pancasila pnj pokoknya univ depok raya rumah w kuliah crb aneh iya,positif
1731,min ppdb tahap depok jabar dibukanya,positif
1732,iya rumah depok kuliah disana,positif
1733,yodah ambil swasta kota depok milih sekolah pendaftaran tutup nyesel gara berharap negri cari sekolah terpadu margonda masuk test woi,negatif
1734,masuk pusing karan zonasi ambil bogor susah ambil depok rumah pertengahan depok bogor sedih banget krna tersingkirkan krna zonasi mama salah ambil pendaftaran ambil nem,negatif
1735,anak diterima sman depok jalur prestasi daftar ulang kemarin form pernyataan orang tua dikembalikan tanggal juli uang seragam juta,negatif
1736,jaman smp nambah kyknyaa perkembangan smp kemarin shokat shokat ditumpangin smpn jdnya smp depok,netral
1737,sebenernya rada random tinggal kabupaten bogor sekolah depok kumpul-kumpul daerah situ asli jakarta,positif
1738,villa cinere mas depok perbatasan jakarta selatan tangerang selatan lt m lb m garasi carport lantai shm selling point terdekat tol jorr desari perbelanjaan pendidikan kesehatan hiburan ibadah,positif
1739,sch pendaftaran depok besok iya,positif
1740,tunggu kuliah depok alias september depok,netral
1741,serius ndah depok smp,negatif
1742,juni partner lomba kompetitor utama level kota ulang diinget aneh iya sekesel lomba ketemu naura tertawa fe path nya gajauh naura bahagia belated birthday adik depok qu,positif
1743,sebenernya g nyangka jalur hidup berbeda orang orang lahir smp kaltim medan pekerjaan kampung inggris pare pekerjaan mondok tahfidz depok,netral
1744,sch titipan tmn masuk jaktim perbatasan depok aman iya terima kasih,netral
1745,jan patah semangat woe sekolah w swasta b snm nembus depok sm semarang,positif
1746,kawan lulusan daerah jakarta depok mohon infonya kenalanku cari kerja terima kasih,positif
1747,goclean penyelamat hidupku kuliah depok,netral
1748,kemana ambil jurusan bahasa indonesia mengambil jurusan to bahasa indonesia tinggal indonesia ambil jurusanya bahasa indonesia lahh suka suka w masuk jurusan depok bogor bodoamat lau sape,negatif
1749,min besuk daftar ppdb zonasi pengaruh yaa daftar online nya depok kerjaan rumah pesanggrahan terima kasih note akun diaktivasi,positif
1750,website ppdb kota depok buka kota depok smp zonasi pendaftaran,positif
1751,marbut masjid depok berinisial tersangka perundungan seksual anak sd keluarga korban melaporkan perilaku menyimpang februari pelaku mengajarkan mengaji mengiming imingi imbalan rp korban,negatif
1752,ih latar belakangnya angkot tokoh utamanya anak anak printis hermina iya warga cening gausah kemana sekedar informasi depok waspada covid terima kasih,negatif
1753,depok nderr,netral
1754,baca komennya lucu he bocah blom ppdb smpn depok dibawah depdikbud tanggal fight jalur prestasi jalur zonasi ppdb madrasah negri jakarta dibawah depagama lulus gratis,positif
1755,sch bagusan bekasi depok iya makasii,netral
1756,lapsat tangsel depok what else elit baca unggulan pokoknya peluang keterima univ top nilai nya b alumni masuk univ nilai sekolah elit,positif
1757,sch masuk masuk depok,negatif
1758,sch saranin swasta daerah depok saranin pgri iya,netral
1759,ppdb sd depok diperuntukkan siswa minimal,netral
1760,kaa sesuai domisili utbknya ktp domisili depok sekolah padang nya kaa,positif
1761,rebahan iya ketempat depok yogyakarta selebihnya smp bali,netral
1762,laporan ditelusuri dlh pohon smp depok tumbang lapuk bpbd sleman menindaklanjuti laporan pohon tumbang dipotong amp dipinggirkan dlh evakuasi potongan pohon maturnuwun,negatif
1763,sch selamat pagi salty iya daftar zonasi iya kakak tinggal bekasi pil daftar depok bekasi rumah terima kasih,positif
1764,mang tinggal kuliah ui depok iya,netral
1765,butuh kayu bakar diambil gratis jupuken sak kayange smp depok peninggalan oknum dinas negor uwit ra diresiki,positif
1766,kelas sd berangkat sekeluarga krl depok amp penuh orang rumah jam pagi indonesia emas jaman,negatif
1767,peserta skpp daring bawaslu memenangkan give away menerima hadiahnya langsung salah pimpinan bawaslu kota depok dede selamet permana,netral
1768,pembagian rapor kenaikan kelas semester genap t a mengikuti standar protokol kesehatan covid smp muhammadiyah depok,negatif
1769,depok sekolah tersesat jakarta bogor,positif
1770,capek capek kuliah tangerang depok kalah salip ani ani beli emas miskin naek boi,netral
1771,moots terfav banget nge hahahah gara gara pen depok sumpah ngomong - ngomong semangat fight ppdb nya hahahahah,netral
1772,they gave me am they gave me jakarta am depok they gave me am they gave me scorpio am aries they gave me single am pcaran renjun drop an emoji and ll tell what think based on ur profile,netral
1773,ppdb jalur zonasi depok jam jam tutup,negatif
1774,wishlist kabul si lulus kuliah kuliah daerah depok iya depok dijogja tertawa jurusan perawat bidan oke kesehatan,positif
1775,duwe konco nang depok jabar ajibarang wis th luwih durung temu,positif
1776,kota tua tempatnya ketawa teman sd seangkatan kaya orang studytour cmn depok seru pokoknyaaaaa,positif
1777,they gave me am hahah they gave me jekate am depok kuliah sby a they gave me am avv they gave me leo a am libra they gave me taken am pacar meng cariin pacar drop an emoji and ll tell what think based on ur profile,netral
1778,kuliah sejarah sains islam at taqwa college depok menyimak kuliah sejarah sains islam attaqwa college depok pertemuan dosen ir budi handrianto mahasiswa muslim sejarah kejayaan peradaban islam bidang sains,positif
1779,jaringannya masuk jalan pendidikan bojongsari depok,negatif
1780,daftar nder dom depok,netral
1781,bocah sd depok,netral
1782,labelnya smp unggulan depok namanya cocok blas,positif
1783,depok yaaa,netral
1784,asli pas sd kayak tokoh masyrakat depok,netral
1785,orang tuanya teman kuliahannya terpaksa bohong pkl jogja kenal kuliah jogja asli depok bilang kenal ig sebentar orang niat jahat,negatif
1786,dibagi zona lintas zona depok dibagi zona timur barat lintas zona gara lupa,negatif
1787,dokumentasi foto aksi senin juni puluhan mahasiswa berorasi pintu gerbang amp gedung kampus depok perwakilan mahasiswa berdialog wakil rektor kemahasiswaan tuntutan mahasiswa,positif
1788,smp bagus depok apaaa iya sch,netral
1789,depok smknya smping smp hanin,netral
1790,oh sd tah beda keluarga pindah akunya depok lulus gawat si tertawa semoga utbk diubah,positif
1791,astaga daftar purwokerto kakak depok depok,positif
1792,sbgi warga depok khawatir pesimis berkurangnya covid warga memakai masker dijln bsr takut polisi satpol pulang pergi jalan sekundernya radar auri pakai masker smp anak usia sd pakai masker,netral
1793,mahasiswa uny depok sleman ono sek kerja group kkn opo ameh kerja wkwkwk,positif
1794,tugas kuliah daring tolong kirim kerumah pakai paket sks jabatan dekan hahaha jalan kaki ilah depok,positif
1795,cerita m dom cibubur kuliah depok katolik suka basket desain sneakers mutualan yukk rep yaa,positif
1796,depok masuk sd negeri anak berdasarkan zonasi usia demo aturannya,negatif
1797,ayo temenan kuliah depok,positif
1798,edc rumah depok ui salemba cancelled smk terdekat,positif
1799,dor m dom cibubur kuliah depok katolik suka basket desain anime mutualan yok,positif
1800,panit binmas polsek depok barat ipda alim melaksanakan kegiatan sambang silaturohmi guru guru smk berkaitan ppdb diy,positif
1801,depok bali bareng sekolahan smada smanti swiis nyampe bali ketemu anak depok,netral
1802,sch dom depok jabar masuk,netral
1803,hallo selamat siang terkait ppdb depok menghubungi iya terima kasih,positif
1804,bali jogjaa template study tour negeri depok,netral
1805,cm teman-teman maaf kampus depok orientasi studi pengenalan kampus online iya kuliah september kampus,positif
1806,terdaftar tanggal juni jalur pilih ditutup dibuka tanggal juni ppdb depok smp prestasi akademik nilai rapor pendaftaran nopen,negatif
1807,dom depok kuliah sby gais,netral
1808,siang admin cek nya sebentar terkait ppdb sd wilayah depok terima kasih,negatif
1809,panit binmas polsek depok barat ipda alim melaksanakan kegiatan sambang silaturohmi guru guru depok sleman berkaitan ppdb diy,positif
1810,ppdb depok kacau banget anjing niat g,negatif
1811,kerja prambanan kuliah solo kos yogya rumah depok jawa barat bapa mamah asli cilacap orang langsung bingung banget dibilang asli orang yogya,positif
1812,siswa bekasi depok kota pinggiran jakarta utbk jakarta becanda ltmpt,netral
1813,sd nyepeda smp nyepeda depok condet manggung nyepeda beli ciu nyepeda kumpul-kumpul nyepeda ngaji nyepeda sejarah anak sepeda sepeda kegiatan kesadaran iya rawat hujat bilangin doain temani sudi,positif
1814,terima jasa membereskan kamar kos sekitaran ui depok akibat pergi kos kuliah onlen beberes packing rapi terpercaya anti klepto wkwkwk ide becanda niat serius tlg sebarin yak butuh bantuan terima kasih,positif
1815,mohon informasi ppdb smp kota depok jalur prestasi nilai raport diundur juni,positif
1816,mohon informasi jalur nilai raport masuk smp kota depok diundur juni,netral
1817,aqni ui take care depok yaa insecure pergaulan penampilan pas kuliah everything will be just fine,positif
1818,pendaftaran kota depok smp zonasi pendaftaran jam,positif
1819,pendaftaran ppdb depok zonasi jdwl tanggal juni pdtran online salam jam wib dftr pkl link ditutup pdhal sistem berjalan salam jam menit jam jadwal website mohon infonya,negatif
1820,oalah base nya kampus depok bayar ujian kalimalang ragu kalimalang base kuliah nya depok,netral
1821,anggota dpr ri nur azizah berharap menkes ri berdayakan mahasiswa kedokteran tenaga gugus tugas covid depok news,netral
1822,pagi jadwal spdb smp kota depok mengalami perubahan jalur prestasi akademik raport berubah tanggal juni jam semalam berhasil daftar,positif
1823,pelaksanaan ppdb smpn depok siswa mendaftarkan ppdb online persyaratan pendaftarannya,netral
1824,sabtu agustus upacara pengibaran bendera memperingati hut ri dihadiri perwakilan orang tua siswa smpn depok,negatif
1825,pendaftaran ppdb smp kota depok diundur tanggal tanggal,negatif
1826,aneh ppdb smp depok jalur anak guru waw spesial guru guru guru tugas lks sistem zonasi bnr masuk butuh nilai rumah depok merata sekolahan,positif
1827,pah asli ketemu berbelas iya idup besok kuliah depok sbm besok lolos aamiin idup disana asli belikan macbook profesional kostan bagus banget banget ohh iphone pah papa janji,positif
1828,depok rantau kuliah pekalongan,netral
1829,smk depok sekolah stm pembangunan namanya,positif
1830,sekolah depok gelar wisuda virtual,positif
1831,sd ngerasain swasta orang ngakalin zonasi depok jaksel yaaa orang anak swasta,negatif
1832,alhamdulillah sukses yaa depok,positif
1833,ppdb kota depok jalur zonasi sesuai jadwal jam jam pendaftaran ditutup mohon infonya,positif
1834,tk ruati lupa anjg pokonya smp depok nya,negatif
